deathtype,gene,description,gene_id,gene_biotype,pmid,comment
Ferroptosis,MIR212,microRNA 212,ENSG00000267195.1,miRNA,31533781,miR-212-5p was significantly downregulated after TBI and functionally suppressed ferroptosis by directly targeting Ptgs2. Administration of miR-212-5p in CCI mice significantly improved learning and spatial memory.
Ferroptosis,NR5A2,nuclear receptor subfamily 5 group A member 2,ENSG00000116833.14,protein_coding,32536370,NCOA3 as a coactivator synergized with NR5A2 to prevent BETi induced ferroptosis.
Ferroptosis,TFAM,"transcription factor A, mitochondrial",ENSG00000108064.11,protein_coding,32186434,Zalcitabine-induced TFAM degradation promotes ferroptosis.
Ferroptosis,CREB5,cAMP responsive element binding protein 5,ENSG00000146592.17,protein_coding,33846793,CREB stimulates GPX4 transcription to inhibit ferroptosis in lung adenocarcinoma.
Ferroptosis,NOS2,nitric oxide synthase 2,ENSG00000007171.19,protein_coding,32080625,Knockdown (KD) of iNOS caused increased sensitivity of M1 RAW 264.7 macrophages and EOC 20 cells to RSL3 induced death that was effectively suppressed by Fer-1.
Ferroptosis,HULC ,hepatocellular carcinoma up-regulated long non-coding RNA,ENSG00000285219,lncRNA,35615577,"HULC was found to function as a ceRNA of miR-3200-5p, and miR-3200-5p regulates ferroptosis by targeting ATF4, resulting in the inhibition of proliferation and metastasis within HCC cells. In summary, these findings illuminate some of the molecular mechanisms through which downregulation of HULC induces liver cancer cell ferroptosis by targeting the miR-3200-5p/ATF4 axis to modulate the development of hepatocellular carcinoma."
Ferroptosis,PLXNB2,plexin B2,ENSG00000196576.16,protein_coding,36423520,"Although HDLBP or lncFAL could not regulate the GPX4 antioxidant signalling pathway, lncFAL reduced ferroptosis vulnerability by directly binding to ferroptosis suppressor protein 1 (FSP1) and competitively abolishing Trim69-dependent FSP1 polyubiquitination degradation. "
Ferroptosis,KIF20A,kinesin family member 20A,ENSG00000112984.12,protein_coding,33819186,High KIF20A expression in resistant CRC cell line suppressed the intracellular ferroptosis process.
Ferroptosis,TIMP1,TIMP metallopeptidase inhibitor 1,ENSG00000102265.12,protein_coding,34938604,Silencing TIMP1 inhibits CMEC ferroptosis by downregulation of TFR-1.
Ferroptosis,MIR615,microRNA 615,ENSG00000207571.1,miRNA,36427803,"Propofol upregulated miR-744-5p/miR-615-3p to inhibit GPX4 transcription. Upregulation of GPX4 or downregulation of miR-744-5p/miR-615-3p attenuated the inhibitory effect of propofol on CR to Cis. In vivo, propofol inhibited tumor growth and CR to Cis by upregulating miR-744-5p/miR-615-3p and inhibiting GPX4 to induce ferroptosis. In summary, propofol inhibited GPX4-mediated ferroptosis and reduces CR of NSCLC cells to Cis through the miR-744-5p/miR-615-3p axis."
Ferroptosis,MIR93,microRNA 93,ENSG00000207757.1,miRNA,36341347,"miR-93-5p was upregulated in the GCs of PCOS patients. Overexpression of miR-93-5p promoted apoptosis and ferroptosis in KGN cells, while knockdown of miR-93-5p showed the reverse effect. Biological analysis and subsequent experiments demonstrated that miR-93-5p negatively regulates the NF- é­_ signaling pathway."
Ferroptosis,ENO3,enolase 3,ENSG00000108515.18,protein_coding,33987359,"In addition, overexpressed ENO3 attenuated the status of ferroptosis."
Ferroptosis,LINC00618,long intergenic non-protein coding RNA 618,,lncRNA,33002417,"LINC00618 promotes apoptosis by increasing the levels of BCL2-Associated X (BAX) and cleavage of caspase-3. LINC00618 also accelerates ferroptosis by increasing the levels of lipid reactive oxygen species (ROS) and iron, two surrogate markers of ferroptosis, and decreasing the expression of solute carrier family 7 member 11 (SLC7A11). Interestingly, VCR-induced ferroptosis and apoptosis are promoted by LINC00618, and LINC00618 accelerates ferroptosis in a manner dependent upon apoptosis. LINC00618 attenuates the expression of lymphoid-specific helicase (LSH), and LSH enhances the transcription of SLC7A11 after the recruitment to the promoter regions of SLC7A11, further inhibiting ferroptosis."
Ferroptosis,MMD,monocyte to macrophage differentiation associated,ENSG00000108960.9,protein_coding,32939090,_NA_
Ferroptosis,NQO1,NAD(P)H quinone dehydrogenase 1,ENSG00000181019.13,protein_coding,26403645,"Knockdown of p62, quinone oxidoreductase_?, heme oxygenase_?, and ferritin heavy chain_? by RNA interference in HCC cells promoted ferroptosis in response to erastin and sorafenib."
Ferroptosis,MARCHF5,membrane associated ring-CH-type finger 5,ENSG00000198060.10,protein_coding,34390730,"Further, in cultured cardiomyocytes stressed with DOX, both MITOL and GPX4 were reduced, whereas forced-expression of MITOL suppressed DOX-induced ferroptosis by maintaining GPX4 content."
Ferroptosis,JUN,"Jun proto-oncogene, AP-1 transcription factor subunit",ENSG00000177606.8,protein_coding,31394193,O-GlcNAcylated c-Jun represents an obstructive factor to ferroptosis.
Ferroptosis,ALDH3A2,aldehyde dehydrogenase 3 family member A2,ENSG00000072210.19,protein_coding,32458004,"Thus, our results show that loss of Aldh3a2 induces ferroptotic cell death in leukemic cells and is synthetically lethal with GPX4 inhibtion."
Ferroptosis,ALOX5,arachidonate 5-lipoxygenase,ENSG00000012779.12,protein_coding,27506793,Silencing ALOX genes made cells resistant to ferroptosis.
Ferroptosis,PARP9,poly(ADP-ribose) polymerase family member 9,ENSG00000138496.17,protein_coding,33722571,PARP inhibition promotes ferroptosis in ovarian cancer cells.
Ferroptosis,GLRX5,glutaredoxin 5,ENSG00000182512.5,protein_coding,32685019,Inhibition of GLRX5 promotes ferroptotic cell death of HNC cells.
Ferroptosis,METTL14,"methyltransferase 14, N6-adenosine-methyltransferase subunit",ENSG00000145388.15,protein_coding,34648132,METTL14 promotes doxorubicin-induced ferroptosis in cardiomyocytes.
Ferroptosis,TOR2A,torsin family 2 member A,ENSG00000160404.18,protein_coding,34296310,The data clearly demonstrated that salusin-Î² might be responsible for HG-induced ferroptosis via inhibiting the Nrf-2 signaling pathway.
Ferroptosis,PARP14,poly(ADP-ribose) polymerase family member 14,ENSG00000173193.15,protein_coding,33722571,PARP inhibition promotes ferroptosis in ovarian cancer cells.
Ferroptosis,MIR130B,microRNA 130b,ENSG00000283871.1,miRNA,34117611,"The results indicated that miR-130b-3p exerted an inhibitory role in erastin or RSL3-induced ferroptosis, evidenced by reductions in lipid peroxidation and ferrous ion content. By suppressing the expression of target gene DKK1, miR-130b-3p activated the Nrf2/HO-1 pathway, whereby repressing ferroptosis. miR-130b-3p blocked the antitumor activity of erastin. Further, in vitro findings were reproduced in an in vivo murine model. Together, these data suggest the potential of miR-130b-3p to inhibit ferroptosis in melanoma cells and the mechanism was related to DKK1-mediated Nrf2/HO-1 pathway."
Ferroptosis,CERS6-AS1,CERS6 antisense RNA 1,ENSG00000227617.9,lncRNA,35777805,"High level of CERS6-AS1 and LASP1 was detected in papillary thyroid cancer tissues and cells and predicted poor prognosis. In contrast, miR-497-5p was decreased in papillary thyroid cancer tissues and cells, which was positively correlated with prognosis. Silencing CERS6-AS1 suppressed cell viability and increased ferroptosis in papillary thyroid cancer. LASP1 was modulated by CERS6-AS1 through sponging miR-497-5p. Up-regulation of LASP1 or silencing miR-497-5p could weaken the effect of CERS6-AS1 on papillary thyroid cancer cells. Silencing CERS6-AS1 restrained the growth of xenografted tumors."
Ferroptosis,NFS1,NFS1 cysteine desulfurase,ENSG00000244005.13,protein_coding,29168506,Suppression of NFS1 cooperates with inhibition of cysteine transport to trigger ferroptosis in vitro and slow tumour growth. Suppression of NFS1 predisposes cancer cells to ferroptosis.
Ferroptosis,SLC3A2,solute carrier family 3 member 2,ENSG00000168003.19,protein_coding,26945935,Required for in vitro cell survival because of its role in protecting cells from ferroptosis.
Ferroptosis,ZFAS1,ZNFX1 antisense RNA 1,ENSG00000177410.13,lncRNA,36092160,"We validated that ZFAS1 may act as a competing endogenous RNA by competitively binding with microRNA-7-5p (miR-7-5p) and modulating the expression of its downstream molecule acyl-CoA synthetase long-chain family member 4 (ACSL4), which is now identified as a classic driver gene of ferroptosis process. In conclusion, our results demonstrate that HG-induced ZFAS1 elevation activates ferroptosis in hRECs and the ZFAS1/miR-7-5p/ACSL4 axis may serve as a therapeutic target for endothelial dysfunction in DR."
Ferroptosis,PANX1,pannexin 1,ENSG00000110218.9,protein_coding,31694915,Deletion protects against ferroptotic cell death. Silenced Panx1 expression significantly attenuated ferroptotic lipid peroxidation and iron accumulation induced by the ferroptosis inducer erastin.
Ferroptosis,HSPB1,heat shock protein family B (small) member 1,ENSG00000106211.10,protein_coding,34791597,HSP27 protects against ferroptosis of glioblastoma cells.
Ferroptosis,CREB1,cAMP responsive element binding protein 1,ENSG00000118260.15,protein_coding,33846793,CREB stimulates GPX4 transcription to inhibit ferroptosis in lung adenocarcinoma.
Ferroptosis,EZH2,enhancer of zeste 2 polycomb repressive complex 2 subunit,ENSG00000106462.12,protein_coding,34614259,Overexpression of EZH2 and SLC7A11 inhibits erastin-induced ferroptosis in TSCC cells.
Ferroptosis,SLC40A1,solute carrier family 40 member 1,ENSG00000138449.11,protein_coding,29949159,A negative regulator of ferroptosis by reducing intracellular iron concentration. Knockdown accelerates erastin-induced ferroptosis.
Ferroptosis,SEMA5A-IT1,,,lncRNA,36284269,"circulating sEVs packaged with SEMA5A-IT1 could be uptaken by cardiomyocyte-like cells AC16 and increased SEMA5A-IT1 expression in AC16 cells. Upregulated SEMA5A-IT1 protected cardiomyocytes against hypoxia/reoxygenation injury, confirmed by increased cell viability, reduced cell apoptosis, and inhibited ferroptosis in AC16 cells. Mechanistically, SEMA5A-IT1 regulated the expression of B-cell CLL/lymphoma 2 (BCL2) and solute carrier family 7 member 11 (SLC7A11) through sponging miR-143-3p. Transfection of miR-143-3p mimics, BCL2, or SLC7A11 knockdown could attenuate the protective effect of SEMA5A-IT1 on cardiomyocytes."
Ferroptosis,PAQR3,progestin and adipoQ receptor family member 3,ENSG00000163291.14,protein_coding,33955706,PAQR3 aggravated ferroptosis in ALL.
Ferroptosis,MIR545,microRNA 545,ENSG00000207820.1,miRNA,34954694,"Our results demonstrate that miR-545 overexpression inhibited, while miR-545 knockdown further increased, erastin and RSL3-induced upregulation of MDA, reactive oxygen species (ROS), and Fe2+ levels. Similarly, miR-545 overexpression partially reversed, while miR-545 knockdown enhanced, the erastin and RSL3-induced reduction in HT-29 and HCT-116 cell survival rates. Transferrin (TF) was identified as a target gene of miR-545. To determine whether miR-545 suppresses ferroptosis via TF, we overexpressed TF in HT-29 and HCT-116 cells. We found that TF overexpression blocked miR-545-induced changes in ROS, MDA, and Fe2+ levels in HT-29 and HCT-116 cells, thereby inducing CRC cell death."
Ferroptosis,MIR6077,microRNA 6077,ENSG00000278596.1,miRNA,35505963,"We demonstrated that miR-6077 protects LUAD cells from cell death induced by CDDP/PEM via CDKN1A-CDK1-mediated cell-cycle arrest and KEAP1-NRF2-SLC7A11/NQO1-mediated ferroptosis, thus resulting in chemoresistance in multiple LUAD cells both in vitro and in vivo. Moreover, we found that GMDS-AS1 and LINC01128 sensitized LUAD cells to CDDP/PEM by sponging miR-6077. Collectively, these results imply the critical role of miR-6077 in LUAD's sensitivity to CDDP/PEM, thus providing a novel therapeutic strategy for overcoming chemoresistance in clinical practice."
Ferroptosis,Lnc-TC,,,lncRNA,36272464,"We observed that the expression of lncRNA TC (Lnc-TC) and CUL4B were increased, but miR-142-5p was decreased in benzene-exposed workers. Correlation analysis suggested that the ceRNAs had co-expression relationships, and were associated with blood cell counts. We further explored the role of ceRNA in vitro, and discovered that 1,4- benzoquinone (1,4-BQ) stimulated ferroptosis in AHH-1 cells by inhibiting the expression of GPX4 and SLC7A11, which was partially relieved by knockdown of Lnc-TC and CUL4B. Finally, by interfering with Lnc-TC and miR-142-5p expression, we confirmed that Lnc-TC acted as a microRNA sponge to reduce the accessibility and inhibition of miR-142-5p to CUL4B, thus increasing the expression of CUL4B."
Ferroptosis,MIR424,microRNA 424,ENSG00000284231.1,miRNA,33038905,"We show that miR-424-5p negatively regulates ferroptosis by directly targeting ACSL4 in ovarian cancer cells. Upregulation of miR-424-5p suppressed ACSL4 by directly binding to its 3'-UTR, which subsequently reduced erastin- and RSL3-induced ferroptosis. Meanwhile, knockdown of miR-424-5p increased the sensitivity of ovarian cancer cells to erastin and RSL3. Furthermore, ACSL4 was upregulated in ovarian cancer tissues, and high ACSL4 expression predicted worse prognosis and sensitized ovarian cancer cells to erastin- and RSL3-induced ferroptosis. Importantly, decreases in lipid peroxides and ferroptotic cell death mediated by miR-424-5p could be abrogated by ACSL4 overexpression."
Ferroptosis,NOX5,NADPH oxidase 5,ENSG00000255346.11,protein_coding,22632970,Suppresses erastin-induced ferroptosis when inhibited by inhibitor.
Ferroptosis,DHODH,dihydroorotate dehydrogenase (quinone),ENSG00000102967.12,protein_coding,33981038,DHODH inhibits mitochondrial ferroptosis.
Ferroptosis,PTPN18,protein tyrosine phosphatase non-receptor type 18,ENSG00000072135.13,protein_coding,33642877,"In the present study, we found that silencing of PTPN18 induced ferroptosis in KLE endometrial cancer cells."
Ferroptosis,CBSLR,CBS mRNA stabilizing lncRNA,,lncRNA,35499052,"CBSLR interacted with YTHDF2 to form a CBSLR/YTHDF2/CBS signaling axis that decreased the stability of CBS mRNA by enhancing the binding of YTHDF2 with the m6A-modified coding sequence (CDS) of CBS mRNA. Furthermore, under decreased CBS levels, the methylation of the ACSL4 protein was reduced, leading to protein polyubiquitination and degradation of ACSL4. This, in turn, decreased the pro-ferroptosis phosphatidylethanolamine (PE) (18:0/20:4) and PE (18:0/22:4) content and contributed to ferroptosis resistance."
Ferroptosis,IARS1,isoleucyl-tRNA synthetase 1,ENSG00000196305,protein_coding,32802409,These evidences suggested cIARS to be a positive regulator of ferroptosis in HCC cells.
Ferroptosis,IL4R,interleukin 4 receptor,ENSG00000077238.14,protein_coding,32808701,CircIL4R knockdown impeded oncogenesis and expedited ferroptosis of HCC cells.
Ferroptosis,SENP1,SUMO specific peptidase 1,ENSG00000079387.14,protein_coding,33746578,SENP1 overexpression suppresses ferroptotic cell death of H9c2 cells.
Ferroptosis,IFNA16,interferon alpha 16,ENSG00000147885.4,protein_coding,34385713,"Together, our results demonstrate that the autoantibodies and the increased IFN-Î± in SLE sera downregulate the expression of GPX4 and lead to neutrophil ferroptosis."
Ferroptosis,SOX2,SRY-box transcription factor 2,ENSG00000181449.4,protein_coding,34385181,Stem Cell Factor SOX2 Confers Ferroptosis Resistance in Lung Cancer via Upregulation of SLC7A11.
Ferroptosis,LIFR,LIF receptor subunit alpha,ENSG00000113594.10,protein_coding,34921145,LIFR and SHP1 positively regulate ferroptosis while LCN2 negatively regulates ferroptosis.
Ferroptosis,MIR199A2,microRNA 199a-2,ENSG00000208024.1,miRNA,36254861,"MiR-199a-5p inhibitor ameliorated ferroptosis-induced cardiomyocyte death as evidenced by the increased cell viability, the reduced reactive oxygen species (ROS) generation, lactate dehydrogenase (LDH) activity, malondialdehyde (MDA) and Fe2+ contents, and the up-regulated glutathione (GSH)/glutathione disulphide (GSSG) ratio as well as glutathione peroxidase 4 (Gpx4) protein expression in H9c2 cells-exposed to OGD/R, while miR-199a-5p mimic had the opposite effects. In addition, OGD/R led to the inhibition of Akt/eNOS signaling pathway, which was also blocked by miR-199a-5p inhibitor and aggravated by miR-199a-5p mimic. Furthermore, LY294002, an inhibitor of Akt/eNOS signaling pathway, abrogated miR-199a-5p inhibitor-induced the reduction of ferroptosis-induced cardiomyocyte death."
Ferroptosis,COX4I2,cytochrome c oxidase subunit 4I2,ENSG00000131055.5,protein_coding,34026834,Our research illustrated that the knockdown of Cox4i2 suppresses HHV7-induced RSC96 cell ferroptosis as well as apoptosis via the ERK signalling pathway.
Ferroptosis,ATF2,activating transcription factor 2,ENSG00000115966.18,protein_coding,33008584,All these results suggested that ATF2 inhibited BETi-induced ferroptosis by increasing NRF2 expression.
Ferroptosis,ABCC5,ATP binding cassette subfamily C member 5,ENSG00000114770.17,protein_coding,34768109,"ABCC5 increased intracellular glutathione (GSH) and attenuated lipid peroxidation accumulation by stabilizing SLC7A11 protein, which inhibited ferroptosis."
Ferroptosis,CCDC6,coiled-coil domain containing 6,ENSG00000108091.11,protein_coding,34841108,"The genetic depletion of CCDC6, by shCCDC6, made the NTERA-2 cells resistant to erastin-induced ferroptosis (Fig. 5 A)."
Ferroptosis,OTUB1,"OTU deubiquitinase, ubiquitin aldehyde binding 1",ENSG00000167770.13,protein_coding,34927544,OTUB1 knockdown triggers ferroptosis dependent on SLC7A11 expression.
Ferroptosis,lncAABR07025387.1 ,,,lncRNA,35186915,"Silencing lncAABR07025387.1 improved MI/R injury in vivo and inhibited myocardial cell ferroptosis under H/R conditions. Bioinformatics analyses and luciferase, pull-down, and RNA-binding immunoprecipitation assays further revealed that lncAABR07025387.1 interacted with miR-205, which directly targeted ACSL4, a known contributor to ferroptosis. Furthermore, downregulating miR-205 reversed the ACSL4 inhibition induced by silencing lncAABR07025387.1. These findings suggest that, mechanistically, lncAABR07025387.1 negatively regulates miR-205 expression and subsequently upregulates ACSL4-mediated ferroptosis."
Ferroptosis,ALOXE3,arachidonate lipoxygenase 3,ENSG00000179148.10,protein_coding,33579899,ALOXE3 knockdown renders GBM cells resistant to p53-induced ferroptosis.
Ferroptosis,mmu_circ_0001751,,,circRNA,35114894,"The binding relationships between mRNAs and miRNAs were verified. circ-Carm1 was highly expressed in OGD/R-treated HT22 cells. Deficiency of circ-Carm1 restored cell viability and suppressed ferroptosis in OGD/R-induced HT22 cells. miR-3098-3p was predicted to be a target of circ-Carm1. The miR-3098-3p inhibitor partly neutralized the functions of circ-Carm1 in OGD/R-induced HT22 cells. Furthermore, acyl-CoA synthetase long-chain family member 4 (ACSL4) was confirmed to be a downstream target of miR-3098-3p and was elevated in OGD/R-induced HT22 cells. Overexpression of ACSL4 mitigated the functions of miR-3098-3p and accelerated HT22 cell dysfunction."
Ferroptosis,SCP2,sterol carrier protein 2,ENSG00000116171.19,protein_coding,25402683,"SCP-2 inhibitors showed anti-ferroptotic activity, which was substantiated by knocking down SCP-2 in Gpx4_?_?cells."
Ferroptosis,PHKG2,phosphorylase kinase catalytic subunit gamma 2,ENSG00000156873.16,protein_coding,27506793,U-2-OS cells became resistant to erastin upon PHKG2 silencing. Erastin-treated HT-1080 cells were rescued by shPHKG2.
Ferroptosis,MTDH,metadherin,ENSG00000147649.10,protein_coding,31527591,Can enhance sensitivity to inducers of ferroptosis. Enhances the vulnerability of cancer cells to ferroptosis.
Ferroptosis,ACO1,aconitase 1,ENSG00000122729.19,protein_coding,34386079,Overexpression of IRP1 significantly promotes erastin- and RSL3-induced ferroptosis.
Ferroptosis,MIR137,microRNA 137,ENSG00000284202.1,miRNA,29348676,MiR-137 negatively regulates ferroptosis by directly targeting glutamine transporter SLC1A5 in melanoma cells.
Ferroptosis,OIP5-AS1,OIP5 antisense RNA 1,ENSG00000247556.7,lncRNA,35872956,"OIP5-AS1 inhibition significantly inhibited EC cell viability and proliferation, induced ferroptosis, and downregulated GPX4 levels, while GPX4 reversed these effects. OIP5-AS1/GPX4 induced CD8+ T cell interaction and induced apoptosis through PD-1/PD-L1 immune checkpoints of CD8+ T cells."
Ferroptosis,MIR494,microRNA 494,ENSG00000194717.4,miRNA,35936219,"Erastin could dose-dependently induce neuron injury and ferroptosis of LUHMES cells. miR-494-3p overexpression induced ROS production, mitochondrial damage, ferroptosis, and neuron injury in erastin-induced LUHMES cells. Likewise, miR-494-3p inhibition had the opposite effects. We also showed that REST was a target gene of miR-494-3p and could repress erastin-induced ferroptosis, neuron injury, ROS, and mitochondrial injury via SP1 in LUHMES cells. Moreover, we demonstrated that SP1 could interact with ACSL4. We also confirmed that miR-494-3p could aggravate the pathological changes of substantia nigra and corpus striatum in the MPTP-induced PD mouse model."
Ferroptosis,MLLT1,MLLT1 super elongation complex subunit,ENSG00000130382.9,protein_coding,32939090,_NA_
Ferroptosis,MIR19B1,microRNA 19b-1,ENSG00000284375,miRNA,30460115,Interactome analysis between these down-regulated gene and up-regulated miRNAs altered by bromelain in CaCO2 cells compared to in DLD-1 cells indicated that ACSL-4 is a key regulatory molecule.
Ferroptosis,RPTOR,regulatory associated protein of MTOR complex 1,ENSG00000141564.16,protein_coding,33707434,mTORC1 inhibition sensitizes cancer cells or tumors to ferroptosis.
Ferroptosis,GCH1,GTP cyclohydrolase 1,ENSG00000131979.20,protein_coding,31989025,Gch1 overexpression and its downstream metabolites BH4/BH2 rescue from ferroptosis. Inhibition of GCH1 activity can sensitize resistant cancer cells to ferroptosis induction.
Ferroptosis,PARP16,poly(ADP-ribose) polymerase family member 16,ENSG00000138617.16,protein_coding,33722571,PARP inhibition promotes ferroptosis in ovarian cancer cells.
Ferroptosis,MIR9-3,microRNA 9-3,ENSG00000284329.1,miRNA,30035324,"Overexpression of miR_? suppressed GOT1, which subsequently reduced ferroptosis. Suppression of miR_? increased the sensitivity of melanoma cells to ferroptosis inducers."
Ferroptosis,CISD3,CDGSH iron sulfur domain 3,ENSG00000277972.2,protein_coding,34497268,CISD3 inhibition drives cystine-deprivation induced ferroptosis.
Ferroptosis,USP35,ubiquitin specific peptidase 35,ENSG00000118369.13,protein_coding,33931967,USP35 knockdown promotes ferroptosis in lung cancer cells.
Ferroptosis,PRKAA1,protein kinase AMP-activated catalytic subunit alpha 1,ENSG00000132356.12,protein_coding,30057310,Inhibition of PRKAA/AMPKalpha diminishes ferroptosis.
Ferroptosis,MAPK14,mitogen-activated protein kinase 14,ENSG00000112062.12,protein_coding,29436589,Ferroptosis was blocked by inhibiting p38 MAPK activation.
Ferroptosis,GRIA3,glutamate ionotropic receptor AMPA type subunit 3,ENSG00000125675.20,protein_coding,32939090,_NA_
Ferroptosis,KDM5C,lysine demethylase 5C,ENSG00000126012.13,protein_coding,34522206,KDM5C suppresses tumorigenicity largely by promoting ferroptosis.
Ferroptosis,DECR1,"2,4-dienoyl-CoA reductase 1",ENSG00000104325.7,protein_coding,32686647,"Collectively, these results suggest that DECR1 expression protect cells from oxidative stress and that DECR1 knockdown-induced cell death is primarily mediated by induction of ferroptosis."
Ferroptosis,VCP,valosin containing protein,ENSG00000165280.18,protein_coding,34033175,"VCP relocalization limits mitochondrial activity, GSH depletion and ferroptosis during starvation in PC3 prostate cancer cells. Moreover, the addition of a VCP inhibitor, CB-5083, in starvation media prevented VCP relocalization and triggered ferroptotic cell death."
Ferroptosis,MIR129-1,microRNA 129-1,ENSG00000207705.2,miRNA,36436380,"The results showed that the expression level of miR-129-3p mRNA in Se-deficient liver was significantly increased. To understand whether the miR-129-3p/SLC7A11 axis could involve in the process of ferroptosis, our further research showed that overexpression of miR-129-3p could reduce the expression of SLC7A11 and its downstream GCL, GSS, and GPX4, thereby inducing ferroptosis. These data indicates that miR-129-3p affected ferroptosis under Se deficiency conditions through the SLC7A11 pathway."
Ferroptosis,PARP10,poly(ADP-ribose) polymerase family member 10,ENSG00000178685.14,protein_coding,33722571,PARP inhibition promotes ferroptosis in ovarian cancer cells.
Ferroptosis,ULK2,unc-51 like autophagy activating kinase 2,ENSG00000083290.20,protein_coding,27514700,Knockout of ULK2 led to significantly lower levels of erastin-induced ferroptosis in a dose- and time-dependent manner.
Ferroptosis,CISD1,CDGSH iron sulfur domain 1,ENSG00000122873.12,protein_coding,27510639,Genetic inhibition of CISD1 contributes to erastin-induced ferroptosis. Stabilization of the iron sulfur cluster of CISD1 inhibits ferroptosis.
Ferroptosis,MIR147A,microRNA 147a,ENSG00000207814.1,miRNA,35942174,"Treatment with the miR-147a mimic significantly induced ferroptosis of glioblastoma cells, and the ferroptotic inhibitors could block the miR-147a mimic-mediated tumor suppression in vitro. Conversely, the miR-147a inhibitor prevented erastin- or RSL3-induced ferroptosis and increased the viability of glioblastoma cells in vitro. Mechanistically, we determined that miR-147a directly bound to the 3'-untranslated region of SLC40A1 and inhibited SLC40A1-mediated iron export, thereby facilitating iron overload, lipid peroxidation, and ferroptosis."
