deathtype,gene,description,gene_id,gene_biotype,pmid,comment
Ferroptosis,MIR138-1,microRNA 138-1,ENSG00000207954,miRNA,35302431,"In addition, AS-IV could inhibit miR-138-5p expression, increase Sirt1/Nrf2 activity, and enhance cellular antioxidant capacity by antagonizing ferroptosis-related processes, thus reducing death of RPE cells. The results of the present study contribute to the understanding of the mechanism underlying high glucose-induced cell apoptosis, and indicate that AS-IV holds potential therapeutic value for DR."
Ferroptosis,MIR144,microRNA 144,ENSG00000283819.1,miRNA,30460115,Interactome analysis between these down-regulated gene and up-regulated miRNAs altered by bromelain in CaCO2 cells compared to in DLD-1 cells indicated that ACSL-4 is a key regulatory molecule.
Ferroptosis,mmu-miR-124-3p,,,miRNA,33068460,"Based on prediction of website tools, expression level of potential miRNAs in ICH tissues and results of luciferase reporter assays, miR-124 was identified to regulate Fpn expression post-ICH. Higher serum miR-124 levels were correlated with poor neurologic scores of aged ICH patients. Administration of miR-124 antagomir enhanced Fpn expression and attenuated iron accumulation in aged mice model. Both apoptosis and ferroptosis, but not necroptosis, were regulated by miR-124/Fpn signaling manipulation."
Ferroptosis,P4HB,prolyl 4-hydroxylase subunit beta,ENSG00000185624.16,protein_coding,35399564,"CircP4HB expression levels were increased in LUAD. It triggered glutathione (GSH) synthesis and, therefore protected LUAD cells from ferroptosis induced by erastin. CircP4HB may function as a competing endogenous RNA by modulating miR-1184 to regulate SLC7A11. CircP4HB inhibited ferroptosis by regulating miR-1184/ SLC7A11-mediated GSH synthesis. In vivo, overexpression of circP4HB promoted tumor growth and inhibited ferroptosis."
Ferroptosis,MIR338,microRNA 338,ENSG00000283604.1,miRNA,35320491,"miR-338-3p targeted the 3' untranslated regions (3'UTR) of SLC1A5 for its inhibition and degradation, and high glucose downregulated SLC1A5 by upregulating miR-338-3p in RPE cells. Next, the miR-338-3p inhibitor and SLC1A5 overexpression vectors were delivered into the RPE cells, and the following gain- and loss-of-function experiments validated that both miR-338-3p ablation and SLC1A5 upregulation abrogated the regulating effects of high glucose on cell proliferation, viability, ferroptosis and ROS production in RPE cells."
Ferroptosis,PTGS2,prostaglandin-endoperoxide synthase 2,ENSG00000073756.13,protein_coding,24439385,"Simply a downstream marker of ferroptosis. The most upregulated gene in BJeLR cells upon treatment with either erastin or (1S, 3R)-RSL3, but ferroptotic cell death was not affected by inhibition of the enzyme."
Ferroptosis,ASAH2,N-acylsphingosine amidohydrolase 2,ENSG00000188611.17,protein_coding,33547170,Our data thus indicate the Asah2 represses Hmox1 expression to reduce lipid ROS to suppress ferroptosis.
Ferroptosis,MIR522,microRNA 522,ENSG00000283685.1,miRNA,32106859,"CAFs secrete exosomal miR-522 to inhibit ferroptosis in cancer cells by targeting ALOX15 and blocking lipid-ROS accumulation. Importantly, cisplatin and paclitaxel promote miR-522 secretion from CAFs by activating USP7/hnRNPA1 axis and ultimately result in decreased chemo-sensitivity."
Ferroptosis,GALNT14,polypeptide N-acetylgalactosaminyltransferase 14,ENSG00000158089.15,protein_coding,34643088,"Altogether, GALNT14 is involved in the ferroptosis of ovarian cancer cells, and downregulation of GALNT14 can trigger ferroptosis in ovarian cancer cells."
Ferroptosis,KDM4C,lysine demethylase 4C,ENSG00000107077.19,protein_coding,33733556,CircKDM4C upregulates P53 by sponging hsa-let-7b-5p to induce ferroptosis in acute myeloid leukemia.
Ferroptosis,FXN,frataxin,ENSG00000165060.15,protein_coding,31974344,FXN deficiency impairs thermogenesis and adipogenesis and increases susceptibility to ferroptosis in cultured adipocytes.
Ferroptosis,MEF2C,myocyte enhancer factor 2C,ENSG00000081189.17,protein_coding,33984142,MEF2C Inhibited Ferroptosis by Upregulating NF2 and E-Cadherin.
Ferroptosis,MDM2,MDM2 proto-oncogene,ENSG00000135679.27,protein_coding,32079652,MDM2 and MDMX promote ferroptosis by PPARÎ±-mediated lipid remodeling.
Ferroptosis,MAP3K14,mitogen-activated protein kinase kinase kinase 14,ENSG00000006062.18,protein_coding,34558831,NIK Acts Cell Autonomously to Promote Hepatocyte Ferroptosis.
Ferroptosis,MDM4,MDM4 regulator of p53,ENSG00000198625.14,protein_coding,32079652,MDM2 and MDMX promote ferroptosis by PPARÎ±-mediated lipid remodeling.
Ferroptosis,ASMTL-AS1,ASMTL antisense RNA 1,ENSG00000236017.8_PAR_Y,lncRNA,34658100,"mechanism assays were done to confirm the relationship among ASMTL-AS1, SAT1 and U2AF2. Results showed that ASMTL-AS1 was down-regulated in LUAD cells and ASMTL-AS1 up-regulation resulted in retarded LUAD cell and xenograft tumor growth along with stimulated ferroptosis. ASMTL-AS1 recruited U2AF2 to stabilize SAT1 mRNA. Furthermore, SAT1 exerted a cancer suppressor role in LUAD cells."
Ferroptosis,NEAT1,nuclear paraspeckle assembly transcript 1,ENSG00000245532.11,lncRNA,35727437,"In conclusion, these findings suggest that sepsis induced high expression of serous exosome-derived NEAT1, and it might exacerbate SAE by promoting ferroptosis through regulating miR-9-5p/TFRC and GOT1 axis."
Ferroptosis,COPZ1,COPI coat complex subunit zeta 1,ENSG00000111481.10,protein_coding,33420375,Knockdown of COPZ1 causes ferroptosis in GBM cells.
Ferroptosis,PLIN2,perilipin 2,ENSG00000147872.10,protein_coding,31520166,An indispensable gene and protein in the suppression of ferroptosis caused by abnormal lipometabolism in gastric carcinoma.
Ferroptosis,FADS2,fatty acid desaturase 2,ENSG00000134824.14,protein_coding,28900510,Depletion of the SCD1 and FADS2 metabolic genes induces ferroptosis.
Ferroptosis,AABR07017145.1 ,,,lncRNA,34938604,"Importantly, we found that lncRNA AAB sponged and sequestered miR-30b-5p to induce the imbalance of MMP9/TIMP1, which enhanced the activation of transferrin receptor 1 (TFR-1) and then eventually led to the ferroptosis of CMECs."
Ferroptosis,MIR7-1,microRNA 7-1,ENSG00000284179,miRNA,31472959,"MiR-7-5p may control radioresistance in various cancer cells at the clinically relevant dose of irradiation. MiR-7-5p downregulates mitoferrin and reduces Fe2+, which influences ferroptosis. "
Ferroptosis,TXN,thioredoxin,ENSG00000136810.13,protein_coding,33634378,Our results suggest that Trx-1 inhibits ferroptosis in PD through regulating GPX4 and GSH.
Ferroptosis,MIR302A,microRNA 302a,ENSG00000207927.1,miRNA,34181495,"The miR-302a-3p mimic induced lipid peroxidation, iron overload and ferroptosis, thereby inhibiting cell growth and colony formation of NSCLCs cells. Conversely, the miR-302a-3p inhibitor block ederastin- or RSL3-related ferroptosis and tumor suppression. Additionally, we found that miR-302a-3p directly bound to the 3'-untranslational region of ferroportin to decrease its protein expression, and that ferroportin overexpression significantly prevented miR-302a-3p mimic-induced ferroptosis and tumor inhibition. Moreover, the miR-302a-3p mimic sensitized NSCLCs cells to cisplatin and paclitaxel chemotherapy."
Ferroptosis,EGLN2,egl-9 family hypoxia inducible factor 2,ENSG00000269858.6,protein_coding,31355331,Inhibiting EGLN2 activation diminished ferroptotic tumor cell death.
Ferroptosis,NCOA3,nuclear receptor coactivator 3,ENSG00000124151.19,protein_coding,32536370,NCOA3 as a coactivator synergized with NR5A2 to prevent BETi induced ferroptosis.
Ferroptosis,SREBF1,sterol regulatory element binding transcription factor 1,ENSG00000072310.18,protein_coding,33229547,SREBP1 Protects Cells from Ferroptosis through SCD1 Activity.
Ferroptosis,LINC01134,long intergenic non-protein coding RNA 1134,ENSG00000236423.8,lncRNA,35875091,Silenced LINC01134 Enhances the Sensitivity of Ferroptosis Inducers
Ferroptosis,MYCN,"MYCN proto-oncogene, bHLH transcription factor",ENSG00000134323.13,protein_coding,34011924,MYCN confers cell sensitivity to ferroptosis upon GPX4 inhibition.
Ferroptosis,IFNA4,interferon alpha 4,ENSG00000236637.5,protein_coding,34385713,"Together, our results demonstrate that the autoantibodies and the increased IFN-Î± in SLE sera downregulate the expression of GPX4 and lead to neutrophil ferroptosis."
Ferroptosis,DPEP1,dipeptidase 1,ENSG00000015413.10,protein_coding,34426578,Dpep1 knockdown ameliorates cisplatin-induced apoptosis and ferroptosis.
Ferroptosis,VDAC2,voltage dependent anion channel 2,ENSG00000165637.14,protein_coding,29569437,Overexpression could partially protect cells from ferroptosis.
Ferroptosis,circRNA1615,,,circRNA,34712388,"circRNA1615 inhibited ferroptosis in cardiomyocytes, and circRNA1615 could regulate the expression of LRP6 through sponge adsorption of miR-152-3p, prevent LRP6-mediated autophagy-related ferroptosis in cardiomyocytes, and finally control the pathological process of MI."
Ferroptosis,PCBP2-OT1,PCBP2 overlapping transcript 1,ENSG00000282977.1,lncRNA,31186710,"The lncRNA function analysis revealed that the ferroptosis pathway, which was associated with SLC7A11, was one of the significant pathways affected. The downregulation of SLC7A11 induced by XAV939 may suppress the development of NSCLC via the ferroptosis pathway."
Ferroptosis,KEAP1,kelch like ECH associated protein 1,ENSG00000079999.14,protein_coding,32939090,_NA_
Ferroptosis,hsa_circ_0026337,,,circRNA,36482742,"CircSCN8A suppressed cell proliferation, migration, invasion, and epithelial-mesenchymal transition (EMT) in vitro and blocked tumor growth in vivo. Moreover, circSCN8A promoted cell ferroptosis in NSCLC. Mechanistically, circSCN8A acted as a competing endogenous RNA (ceRNA) by sponging miR-1290 to enhance the expression of long-chain acyl-CoA synthetase-4 (ACSL4). Furthermore, the knockdown of ACSL4 or overexpression of miR-1290 reversed the effect of circSCN8A on facilitating ferroptosis and inhibiting cell proliferation and metastasis. In summary, circSCN8A represses cell proliferation and metastasis in NSCLC by regulating the miR-1290/ACSL4 axis to induce ferroptosis."
Ferroptosis,RPL8,ribosomal protein L8,ENSG00000161016.18,protein_coding,22632970,Required in erastin-induced ferroptosis. Silencing of it conferred against erastin-induced ferroptosis.
Ferroptosis,ALOX12,"arachidonate 12-lipoxygenase, 12S type",ENSG00000108839.12,protein_coding,33290842,Hydrogen sulfide guards myoblasts from ferroptosis by inhibiting ALOX12 acetylation.
Ferroptosis,ACSF2,acyl-CoA synthetase family member 2,ENSG00000167107.13,protein_coding,22632970,Required in erastin-induced ferroptosis. Silencing of it conferred against erastin-induced ferroptosis.
Ferroptosis,KDM5A,lysine demethylase 5A,ENSG00000073614.13,protein_coding,33741422,KDM5A inhibition decreases ferroptosis sensitivity in erPCC.
Ferroptosis,NRAS,"NRAS proto-oncogene, GTPase",ENSG00000213281.5,protein_coding,26157704,NRAS12V mutant protects RMS13 cells from ferroptotic cell death.
Ferroptosis,MIR30E,microRNA 30e,ENSG00000198974.3,miRNA,35068337,"EPCs-Exos inhibited Erastin-induced HUVEC ferroptosis and endothelial injury. Erastin inhibited miR-30e-5p and EPCs-Exo treatment recovered miR-30e-5p expression. miR-30e-5p was encapsulated in EPCs-Exos. After inhibiting miR-30e-5p in EPCs, the inhibitory effect of EPCs-Exos on HUVEC ferroptosis was attenuated. miR-30e-5p targeted SP1. Overexpression of SP1 partially reversed the effect of EPCs-Exos on improving HUVEC ferroptosis and increasing phosphorylation levels of AMPK. Collectively, EPCs-Exos inhibited Erastin-induced HUVEC ferroptosis by upregulating miR-30e-5p, inhibiting SP1, and activating the AMPK pathway."
Ferroptosis,OGFRP1,opioid growth factor receptor pseudogene 1,ENSG00000182057.5,transcribed_pseudogene,36066402,"The interaction between miR-299-3p and OGFRP1 or solute carrier family 38 member 1 (SLC38A1) was predicted by StarbaseV3.0 and verified by dual-luciferase reporter assay and Pearson's correlation coefficient. Besides, a transplantation model of human lung cancer in nude mice was established to evaluate the role of OGFRP1 in lung cancer. OGFRP1 and SLC38A1 were overexpressed, whereas miR-299-3p was lowly expressed in lung cancer tumors and cells. OGFRP1 knockdown suppressed cell proliferation and facilitated ferroptosis by promoting lipid peroxidation and iron accumulation in lung cancer. Besides, Furthermore, miR-299-3p inhibitor or SLC38A1 overexpression attenuated OGFRP1 depletion-induced suppression on cell proliferation and ferroptosis in lung cancer. Animal experiments indicated that OGFRP1 deficiency restrained tumor growth in vivo by regulating the miR-299-3p/SLC38A1 axis."
Ferroptosis,TF,transferrin,ENSG00000091513.16,protein_coding,32374849,"Trf-LKO mice display iron-deficiency anemia, iron overload in tissues, and susceptibility to liver damage via ferroptosis."
Ferroptosis,ETV4,ETS variant transcription factor 4,ENSG00000175832.13,protein_coding,34283663,"Overall, the data suggested that the knockdown of ETV4 suppressed the PTC progression by promoting ferroptosis upon SLC7A11 downregulation."
Ferroptosis,PLA2G6,phospholipase A2 group VI,ENSG00000184381.20,protein_coding,33542532,Phospholipase iPLA2Î² Averts Ferroptosis By Eliminating A Redox Lipid Death Signal.
Ferroptosis,POR,cytochrome p450 oxidoreductase,ENSG00000127948.17,protein_coding,32080622,These data indicate that POR is a key enzyme involved in the execution of ML210/RSL3-induced ferroptotic cell death in melanoma and ccRCC cells.
Ferroptosis,BRPF1,bromodomain and PHD finger containing 1,ENSG00000156983.17,protein_coding,32939090,_NA_
Ferroptosis,TMBIM4,transmembrane BAX inhibitor motif containing 4,ENSG00000155957.19,protein_coding,31507082,Protects against ferroptosis in HCC cells. Inhibition increased ferroptotic cel death.
Ferroptosis,KRAS,"KRAS proto-oncogene, GTPase",ENSG00000133703.14,protein_coding,26157704,KRAS12V mutant protects RMS13 cells from ferroptotic cell death.
Ferroptosis,AHCY,adenosylhomocysteinase,ENSG00000101444.13,protein_coding,32144268,"Suppression of SAHH expression by RNA interference also promoted erastin-induced accumulation of lipid ROS (Fig. 5i, j), which phenocopied the DJ-1 KD effect."
Ferroptosis,MIR34C,microRNA 34c,ENSG00000207562.3,miRNA,35093695,"The results showed lower expression of miR-34c-3p in OSSC compared with normal tissues. Overexpression of miR-34c-3p in SCC-25 cells suppressed cell proliferation. In addition, the overexpression of miR-34c-3p promoted ferroptosis by increasing ROS, MDA, and iron and decreasing GSH and GPX4 levels in SCC-25 cells."
Ferroptosis,ATG3,autophagy related 3,ENSG00000144848.11,protein_coding,27514700,"Potential positive regulators of ferroptosis. Knockout of ATG3 greatly reduced the sensitivity of MEFs to ferropotosis, and reconstituting ATG3 back to these cells restored the ferroptosis sensitivity."
Ferroptosis,MIR30B,microRNA 30b,ENSG00000207582.1,miRNA,31926626,"Microarrays, bioinformatic analysis, and luciferase reporter assay revealed that upregulation of miR-30b-5p in PE models plays a pivotal role in ferroptosis, by downregulating Cys2/glutamate antiporter and PAX3 and decreasing ferroportin 1 (an iron exporter) expression, resulting in decreased GSH and increased labile Fe2+. Inhibition of miR-30b-5p expression and supplementation with ferroptosis inhibitors attenuated the PE symptoms in rat models, making miR-30b-5p a potential therapeutic target for PE."
Ferroptosis,LYRM1,LYR motif containing 1,ENSG00000102897.10,protein_coding,32939090,_NA_
Ferroptosis,SIRT6,sirtuin 6,ENSG00000077463.15,protein_coding,34530350,SIRT6 silencing overcomes resistance to sorafenib by promoting ferroptosis in gastric cancer.
Ferroptosis,MIR672,,,miRNA,35237382,"The luciferase reporter assay demonstrated that miR-672-3p downregulated FSP1, a glutathione-independent ferroptosis suppressor, by binding to its 3' untranslated region. Oxygen and glucose deprivation- (OGD-) treated PC12 and AGE1.HN cells were treated with miR-672-3p mimics or inhibitors in vitro. The effect of miR-672-3p mimics or inhibitor on OGD-PC12/AGE1.HN ferroptosis was evaluated by flow cytometry, immunohistochemistry, immunofluorescence, and western blotting. The miR-672-3p mimics promoted ferroptosis after SCI, whereas the miR-672-3p inhibitor inhibited this process."
Ferroptosis,KMT2D,lysine methyltransferase 2D,ENSG00000167548.18,protein_coding,34890228,Mll4 deficiency impairs ferroptosis via rewired gene expression.
Ferroptosis,LPIN1,lipin 1,ENSG00000134324.12,protein_coding,31061954,Overexpression of adipose lipin_? in mice facilitated the onset of hepatic ferroptosis.
Ferroptosis,MBOAT2,membrane bound O-acyltransferase domain containing 2,ENSG00000143797.12,protein_coding,37267948,"In this study, through a whole-genome CRISPR activation screen, followed by mechanistic investigation, we identified phospholipid-modifying enzymes MBOAT1 and MBOAT3 as ferroptosis suppressors"
Ferroptosis,KDM3B,lysine demethylase 3B,ENSG00000120733.14,protein_coding,32107878,Overexpressed KDM3B prevents cells from Erastin-induced ferroptosis.
Ferroptosis,ARHGEF26-AS1,ARHGEF26 antisense RNA 1,ENSG00000243069.9,lncRNA,35003396,LncRNA ARHGEF26-AS1 Facilitated Ferroptosis but Restrained Cell Growth and Positively Regulated ADAM23 by Sponging miR-372-3p in ECC.
Ferroptosis,MIR9-1,microRNA 9-1,ENSG00000207933.3,miRNA,30035324,"Overexpression of miR_? suppressed GOT1, which subsequently reduced ferroptosis. Suppression of miR_? increased the sensitivity of melanoma cells to ferroptosis inducers."
Ferroptosis,AIFM2,apoptosis inducing factor mitochondria associated 2,ENSG00000042286.15,protein_coding,31964528,AIFM2 blocks ferroptosis independent of ubiquinol metabolism.
Ferroptosis,PRDX1,peroxiredoxin 1,ENSG00000117450.15,protein_coding,31901729,"Consistent with our previous observation, loss of PRDX1 was sufficient to induce a significant increase in lipid peroxidation (Fig. 3B)."
Ferroptosis,FOXO4,forkhead box O4,ENSG00000184481.17,protein_coding,34296293,"In addition, the inhibitory effects of ENPP2 on DOX-induced ferroptosis were significantly reduced by FoxO4 overexpression, as demonstrated by increased Fe2+ and lipid ROS activity levels, decreased SLC7A11, GPX4 and FPN1 expression, and increased NOX4 expression, which were observed following FoxO4 overexpression (Fig. 6A-C)."
Ferroptosis,BMAL1,basic helix-loop-helix ARNT like 1,ENSG00000133794,protein_coding,31355331,Degration of the protein is critical for ferroptosis. Blocking ARNTL degradation diminished ferroptotic tumor cell death.
Ferroptosis,MIR127,microRNA 127,ENSG00000207608.3,miRNA,35818586,"Expression levels of miR-127-5p and JAM3 were analyzed by RT-qPCR. GPX4 expression was quantified by western blotting. Results. miR-127-5p was expressed at low levels in IOMM-Lee cells, while JAM3 was highly expressed in IOMM-Lee cells. A dual luciferase assay demonstrated that miR-127-5p could target JAM3. Upregulation of miR-127-5p in IOMM-Lee cells resulted in cell cycle arrest and inhibition of cell activity. Upregulation of miR-127-5p increased LDH, MDA, and ROS levels and Fe2+ content and inhibited the expression of GPX4 protein. Upregulation of JAM3 reversed the results of miR-127-5p upregulation. Conclusion. miR-127-5p regulated meningioma formation and ferroptosis through JAM3, providing insights for the development of new treatments for meningioma."
Ferroptosis,TGFBR1,transforming growth factor beta receptor 1,ENSG00000106799.14,protein_coding,30804470,Inhibition attenuated erastin-induced ferroptosis.
Ferroptosis,NR1D2,nuclear receptor subfamily 1 group D member 2,ENSG00000174738.13,protein_coding,33068011,Targeted inhibition of Rev-erb-Î±/Î² limits ferroptosis to ameliorate folic acid-induced AKI in mice.
Ferroptosis,FZD7,frizzled class receptor 7,ENSG00000155760.3,protein_coding,33172933,"Conversely, FZD7 overexpression induced increased GPX4 mRNA and protein expression levels. FZD7 Marks a Cell Population Susceptible to GPX4 Inhibitors."
Ferroptosis,G6PD,glucose-6-phosphate dehydrogenase,ENSG00000160211.20,protein_coding,34325001,G6PD inhibits ferroptosis in HCC cells.
Ferroptosis,HRAS,"HRas proto-oncogene, GTPase",ENSG00000174775.18,protein_coding,26157704,HRAS12V mutant protects RMS13 cells from ferroptotic cell death.
Ferroptosis,SLC38A1,solute carrier family 38 member 1,ENSG00000111371.16,protein_coding,32453709,"Mechanistically, silencing of lncRNA ZFAS1 attenuated ferroptosis and PF progression by lncRNA ZFAS1 acting as a competing endogenous RNA (ceRNA) and sponging miR-150-5p to downregulate SLC38A1 expression."
Ferroptosis,SLC39A14,solute carrier family 39 member 14,ENSG00000104635.15,protein_coding,32374849,Loss of hepatic Slc39a14 protects against ferroptosis-induced liver fibrosis in Trf-LKO mice
Ferroptosis,MIR21,microRNA 21,ENSG00000284190.1,miRNA,35738798,"MiRNAs expression profile of melanoma cells in IFN-çº?driven ferroptosis was first obtained. Then, upregulated miR-21-3p was proved to facilitate IFN-çº?mediated ferroptosis by potentiating lipid peroxidation. miR-21-3p increased the ferroptosis sensitivity by directly targeting thioredoxin reductase 1 (TXNRD1) to enhance lipid reactive oxygen species (ROS) generation. Furthermore, miR-21-3p overexpression in tumor synergized with anti-PD-1 antibody by promoting tumor cell ferroptosis. More importantly, miR-21-3p-loaded gold nanoparticles were constructed, and the systemic delivery of them increased the efficacy of anti-PD-1 antibody without prominent side effects in preclinical mice model. Ultimately, ATF3 was found to promote miR-21-3p transcription in IFN-çº?driven ferroptosis."
Ferroptosis,MIR1-1,microRNA 1-1,ENSG00000199017,miRNA,36481629,
Ferroptosis,PROM2,prominin 2,ENSG00000155066.16,protein_coding,34223704,"Together, these data indicate that cells can resist ferroptosis by activating p38 and, consequently, inducing prominin2."
Ferroptosis,NFE2L2,NFE2 like bZIP transcription factor 2,ENSG00000116044.17,protein_coding,32601262,Nrf2 inhibits ferroptosis and protects against acute lung injury due to intestinal ischemia reperfusion via regulating SLC7A11 and HO-1.
Ferroptosis,GABARAPL1,GABA type A receptor associated protein like 1,ENSG00000139112.11,protein_coding,27514700,Potential positive regulators of ferroptosis.
Ferroptosis,MIR335,microRNA 335,ENSG00000199043.1,miRNA,33649797,"The luciferase 3'-untranslated region reporter results identified FTH1 as the direct target of miR-335. The silencing of FTH1 in 6-OHDA-stimulated cells enhanced the effects of miR-335 on ferroptosis and promoted PD pathology. Mechanistically, miR-335 enhanced ferroptosis through the degradation of FTH1 to increase iron release, lipid peroxidation and reactive oxygen species (ROS) accumulation, and to decrease mitochondrial membrane potential (MMP). "
Ferroptosis,PTEN,phosphatase and tensin homolog,ENSG00000171862.14,protein_coding,33229547,"Notably, we found that cancer cells carrying PIK3CA activating mutation or PTEN deletion appeared to be more resistant to RSL3. These mutations lead to the activation of the oncogenic PI3K-AKT signaling pathway. Therefore, sustained activation of the PI3K-AKT-mTOR pathway protects cancer cells from ferroptotic cell death."
Ferroptosis,PARP4,poly(ADP-ribose) polymerase family member 4,ENSG00000102699.6,protein_coding,33722571,PARP inhibition promotes ferroptosis in ovarian cancer cells.
Ferroptosis,MS4A15,membrane spanning 4-domains A15,ENSG00000166961.15,protein_coding,34663908,Ms4a15 expression specifically blocks ferroptosis.
Ferroptosis,TIMM9,translocase of inner mitochondrial membrane 9,ENSG00000100575.14,protein_coding,32939090,_NA_
Ferroptosis,PARP3,poly(ADP-ribose) polymerase family member 3,ENSG00000041880.15,protein_coding,33722571,PARP inhibition promotes ferroptosis in ovarian cancer cells.
Ferroptosis,WIPI1,"WD repeat domain, phosphoinositide interacting 1",ENSG00000070540.13,protein_coding,27514700,Potential positive regulators of ferroptosis.
Ferroptosis,SNX5,sorting nexin 5,ENSG00000089006.17,protein_coding,34134000,Super-enhancer-driven Sorting Nexin 5 expression promotes dopaminergic neuronal ferroptosis in Parkinson's disease models.
Ferroptosis,LINC00239,long intergenic non-protein coding RNA 239,ENSG00000258512.2,lncRNA,36038548,
Ferroptosis,hsa_circ_0000745,,,circRNA,34957935,"Circ_0000745 expression was elevated in ALL patients and cell lines. Circ_0000745 knockdown restrained cell cycle progression and glycolysis and triggered cell apoptosis and ferroptosis. Circ_0000745 acted as a molecular sponge for miR-494-3p in ALL cells. miR-494-3p silencing partly diminished circ_0000745 knockdown-induced anti-tumor effects in ALL cells. NET1 was a target of miR-494-3p, and miR-494-3p overexpression-induced anti-tumor influences were partly counteracted by the accumulation of NET1 in ALL cells. Circ_0000745 can positively regulate NET1 expression by sponging miR-494-3p in ALL cells."
Ferroptosis,PIEZO1,piezo type mechanosensitive ion channel component 1,ENSG00000103335.22,protein_coding,34568428,"Increased PIEZO1 expression or activation of PIEZO1 could activate Ca2+/calpain signaling, which promoted the cleavage VE-cadherin, thereby promoting ferroptosis."
Ferroptosis,AKR1C2,aldo-keto reductase family 1 member C2,ENSG00000151632.18,protein_coding,31780644,Inhibition completely resensitizes resistant melanoma cells to ferroptosis execution.
Ferroptosis,MIR4443,microRNA 4443,ENSG00000265483.1,miRNA,33781830,"Through bioinformatics analysis and luciferase assays, METTL3 was confirmed as a direct target gene of miR-4443. Further mechanistic analysis showed that miR-4443 regulated the expression of FSP1 in an m6A manner via METLL3."
