deathtype,gene,description,gene_id,gene_biotype,pmid,comment
Ferroptosis,SLC16A1-AS1,SLC16A1 antisense RNA 1,ENSG00000226419.8,lncRNA,35167383,"Our study revealed that SLC16A1-AS1 has high expression and was associated with overall survival in renal cancer. Knockdown SLC16A1-AS1 inhibited cell viability, proliferation, and migration of renal cancer cells. Furthermore, it was demonstrated that SLC16A1-AS1 served as a sponge of miR-143-3p, and knockdown SLC16A1-AS1 significantly increased the enrichment of miR-143-3p. And then, SLC7A11 was identified as the target protein of miR-143-3p, and overexpression miR-143-3p remarkably inhibited the expression of SLC7A11. Moreover, knockdown SLC16A1-AS1 could aggravate this effect. Finally, through inhibiting SLC7A11 expression, silencing SLC16A1-AS1 induced ferroptosis via increasing miR-143-3p."
Ferroptosis,hsa_circ_0085536,,,circRNA,34966683,"CircPVT1 was significantly upregulated in ESCC cells resistant to 5-FU. Knockdown of circPVT1 enhanced the 5-FU chemosensitivity of ESCC cells resistant to 5-FU by increasing cytotoxicity and downregulating multidrug-resistant associated proteins, including P-gp and MRP1. Luciferase assay showed that circPVT1 acted as a sponge of miR-30a-5p, and Frizzled3 (FZD3) was a downstream target of miR-30a-5p. The enhanced 5-FU chemosensitivity by circPVT1 knockdown was reversed with miR-30a-5p inhibitor. Besides, the increased 5-FU chemosensitivity by miR-30a-5p mimics was reversed with FZD3 overexpression. Furthermore, knockdown of circPVT1 increased ferroptosis through downregulating p-å°?catenin, GPX4, and SLC7A11 while miR-30a-5p inhibition and FZD3 overexpression reversed the phenotype by upregulating p-å°?catenin, GPX4, and SLC7A11."
Ferroptosis,FAR1,fatty acyl-CoA reductase 1,ENSG00000197601.14,protein_coding,33731874,Inactivation of FAR1 diminishes SFA-dependent ferroptosis.
Ferroptosis,CISD2,CDGSH iron sulfur domain 2,ENSG00000145354.12,protein_coding,34485112,Knockdown of CISD2 Promotes Ferroptosis in Sorafenib-Resistant Cells.
Ferroptosis,MAPK3,mitogen-activated protein kinase 3,ENSG00000102882.12,protein_coding,29330409,ERK1/2 inhibitors inhibited t-BHP-induced ferroptosis. t-BHP treatment significantly increased the protein expression of p-ERK.
Ferroptosis,CYGB,cytoglobin,ENSG00000161544.10,protein_coding,33611811,CYGB improved lipid oxidation and increased sensitivity to ferroptosis.
Ferroptosis,MLST8,"MTOR associated protein, LST8 homolog",ENSG00000167965.18,protein_coding,34949833,mTORC2 ablation induces ferroptosis in memory CD4+ T cells.
Ferroptosis,PANX2,pannexin 2,ENSG00000073150.14,protein_coding,32547072,PANX2 Silencing Promotes Ferroptosis in PCa Cells.
Ferroptosis,PEBP1,phosphatidylethanolamine binding protein 1,ENSG00000089220.5,protein_coding,32513718,We found that PEBP1 KO HT22 cells demonstrated very high resistance to RSL3-induced ferroptosis compared with wild-type control cells.
Ferroptosis,PARP8,poly(ADP-ribose) polymerase family member 8,ENSG00000151883.19,protein_coding,33722571,PARP inhibition promotes ferroptosis in ovarian cancer cells.
Ferroptosis,GJA1,gap junction protein alpha 1,ENSG00000152661.9,protein_coding,34785303,"Therefore, our results indicated that downregulation of Cx43 can inhibit ferroptosis by restoring the level of SLC7A11 in the system xc- transporter and alleviate cisplatin-induced AKI."
Ferroptosis,BAP1,BRCA1 associated protein 1,ENSG00000163930.10,protein_coding,30907299,Promotes ferroptosis induced by class I ferroptosis inducer.
Ferroptosis,MAP3K11,mitogen-activated protein kinase kinase kinase 11,ENSG00000173327.8,protein_coding,32710001,Inhibition of MLK3 improves cardiac function and inhibits ferroptosis at week 8 of TAC.
Ferroptosis,TTBK2,tau tubulin kinase 2,ENSG00000128881.18,protein_coding,32196629,"Levels of circ-TTBK2 and ITGB8 were upregulated, whereas miR-761 level was low-expressed in glioma tissues and cells. CircTTBK2 was a sponge of miR-761 to modulate ITGB8. Additionally, circ-TTBK2 knockdown or miR-761 increase could retard cell proliferation, invasion, and promote ferroptosis in glioma cells. Interestingly, miR-761 inhibitor could abolish the repressive impact of circ-TTBK2 silencing on cell growth in vitro. Also, the influence of miR-761 mimic on cell phenotypes was regained after ITGB8 upregulation. Meanwhile, circ-TTBK2 deficiency caused the decrease of tumor growth."
Ferroptosis,MIR214,microRNA 214,ENSG00000283844.1,miRNA,35366755,"The relationship between TEC ferroptosis and cisplatin-induced AKI was investigated in vitro and in vivo. Ferrostatin-1(Fer-1), an inhibitor of ferroptosis, was observed to confer a protective effect against the renal tubular injury and renal failure induced by cisplatin. MicroRNAs (miRNAs) regulate the genes that have important functions in the development of cis-AKI. In the present study, GPX4 was predicted as a target of miR-214-3p. Moreover, inhibiting miR-214-3p enhanced the expressions of GPX4 and SLC7A11 while decreasing the ACSL4 expression. Furthermore, miR-214-3p down-regulation protected against TEC death and renal tubule damage both in vitro and in vivo. "
Ferroptosis,PARP15,poly(ADP-ribose) polymerase family member 15,ENSG00000173200.13,protein_coding,33722571,PARP inhibition promotes ferroptosis in ovarian cancer cells.
Ferroptosis,HDDC3,HD domain containing 3,ENSG00000184508.12,protein_coding,32462112,"Ferroptosis-inducing erastin or cystine deprivation elevates MESH1, whose overexpression depletes NADPH and sensitizes cells to ferroptosis, whereas MESH1 depletion promotes ferroptosis survival by sustaining the levels of NADPH and GSH and by reducing lipid peroxidation."
Ferroptosis,MIR10A,microRNA 10a,ENSG00000284038.1,miRNA,33166496,"Results from current study suggests that inflammatory cytokine IL-6 appeared in IVD aggravates its degeneration by inducing cartilage cell ferroptosis. This is caused partially by inhibiting miR-10a-5p and subsequently derepressing IL-6R signaling pathway. Our study provides a novel mechanism explaining inflammatory cytokine-caused cartilage cell death in degenerative IVD, and makes IL-6/miR-10a-5p/IL-6R axis a potential therapeutic target for intervention of IDD."
Ferroptosis,CGAS,cyclic GMP-AMP synthase,ENSG00000164430.17,protein_coding,32186434,The CGAS-STING1 pathway promotes zalcitabine-induced ferroptosis.
Ferroptosis,SIRT2,sirtuin 2,ENSG00000068903.21,protein_coding,34102645,SIRT2 inhibition exacerbates p53-mediated ferroptosis in mice following experimental traumatic brain injury.
Ferroptosis,PPARD,peroxisome proliferator activated receptor delta,ENSG00000112033.14,protein_coding,34649350,GW501516-activated PPARÎ´ attenuates ferroptotic death of xCT-deficient MEFs.
Ferroptosis,EGR1,early growth response 1,ENSG00000120738.8,protein_coding,34339707,Knockdown of Egr-1 alleviated ferroptosis in HL-1 cells under anoxic condition.
Ferroptosis,AQP3,aquaporin 3 (Gill blood group),ENSG00000165272.16,protein_coding,33017631,"Further, we observed that aquaporin (AQP) 3, 5, and 8 bind nicotinamide-adenine dinucleotide phosphate oxidase 2 and regulate the permeability of extracellular H2O2, thereby contributing to ferroptosis."
Ferroptosis,HSF1,heat shock transcription factor 1,ENSG00000185122.11,protein_coding,34223704,HSF1 inhibition sensitizes cancer cells to ferroptotic cell death.
Ferroptosis,MIR18A,microRNA 18a,ENSG00000283815.1,miRNA,31160087,This study revealed a novel mechanism through which miR-17-92 protects endothelial cells from erastin-induced ferroptosis by targeting the A20-ACSL4 axis.
Ferroptosis,OSBPL9,oxysterol binding protein like 9,ENSG00000117859.19,protein_coding,32939090,_NA_
Ferroptosis,SESN2,sestrin 2,ENSG00000130766.5,protein_coding,34482365,Sesn2 suppresses septic-induced ferroptosis to improve the immune function of DCs.
Ferroptosis,BECN1,beclin 1,ENSG00000126581.13,protein_coding,33058849,Beclin1 haploinsufficiency rescues low ambient temperature-induced cardiac remodeling and contractile dysfunction through inhibition of ferroptosis and mitochondrial injury.
Ferroptosis,FTMT,ferritin mitochondrial,ENSG00000181867.3,protein_coding,33953171,FtMt deletion aggravates cerebral I/R-induced ferroptosis.
Ferroptosis,MIR7212,microRNA 7212,,miRNA,35957725,"A total of 4,754 DEGs were identified between the two groups using high-throughput sequencing. The pathways in which DEGs were enriched included ferroptosis (the highest enrichment score), apoptosis, and the PI3K-Akt, NF-kappa B and IL-17 signaling pathways. Seven (Hmox1, Spp1, Socs3, Mapk14, Lcn2, Cxcl1 and Cxcl12) of the 15 hub genes were involved in the KEGG pathway. mmu-miR-7212-5p-Hmox1 was a key RNA regulatory axis in ferroptosis. m6A RNA methylation modifications were involved in SA-AKI. The correlation analyses showed the close interactions among the m6A RNA methylation regulators and important hub genes."
Ferroptosis,HCAR1,hydroxycarboxylic acid receptor 1,ENSG00000196917.6,protein_coding,33296645,These observations support our hypothesis that HCAR1 and MCT1 are involved in the lactate-dependent ferroptosis resistance in tumor cells. Blocking the HCAR1/MCT1-Mediated Lactate Import Exacerbates Ferroptosis
Ferroptosis,HILPDA,hypoxia inducible lipid droplet associated,ENSG00000135245.10,protein_coding,30962421,Promotes ferroptosis sensitivity downstream of HIF-2alpha.
Ferroptosis,circIL4R,,,circRNA,32808701,CircIL4R was abnormally overexpressed in HCC tissues and cells. CircIL4R knockdown impeded oncogenesis and expedited ferroptosis of HCC cells. CircIL4R could directly sponge microRNA-541-3p (miR-541-3p) and miR-541-3p inhibition mitigated the effects of circIL4R knockdown on HCC cells. CircIL4R acted as a miR-541-3p sponge to regulate its target glutathione peroxidase 4 (GPX4). GPX4 upregulation relieved the miR-541-3p-induced tumor inhibition and ferroptosis aggravation. CircIL4R played an oncogenic role in HCC via the miR-541-3p/GPX4 axis in vivo.
Ferroptosis,GSTM1,glutathione S-transferase mu 1,ENSG00000134184.13,protein_coding,34586745,"Moreover, the results suggest that GSTM1 may be a novel negative regulator of ferroptosis in addition to GPX4."
Ferroptosis,MIR222,microRNA 222,ENSG00000207725.3,miRNA,34978008,"The results showed that supplementation of exosomes derived from HBV-infected LO2 cells remarkably enhanced LX-2 cell activation, evidenced by elevated hydroxyprolin (Hyp) secretion and ä¼?SMA and COL1A2 expression. miR-222 was significantly increased in HBV-Exo. Overexpressing miR-222 upregulated cell viability, secretion of Hpy, and expression of ä¼?SMA and COL1A2, which were all blocked by overexpression of TFRC. Further study showed that TFRC was a target of miR-222, and miR-222 promoted LX-2 cell activation through suppressing TFRC-induced ferroptosis in LX-2 cells. Exosomal miR-222 derived from HBV-infected hepatocytes promoted LF through inhibiting TFRC and TFRC-induced ferroptosis."
Ferroptosis,RARRES2,retinoic acid receptor responder 2,ENSG00000106538.10,protein_coding,33757970,Chemerin inhibition increases oxidized lipid and enhances ferroptosis susceptibility.
Ferroptosis,BRD4,bromodomain containing 4,ENSG00000141867.19,protein_coding,32937365,Inhibition of BET and the proteasome triggers ferroptosis cell death.
Ferroptosis,SOCS1,suppressor of cytokine signaling 1,ENSG00000185338.7,protein_coding,29081404,"Expression of SOCS1 sensitized cells to ferroptosis inducer. This effect of SOCS1 was efficiently blocked by ferroptosis inhibitor. Expression of SOCS1 reduced the levels of GSH, explaining in part its ability to sensitize cells to ferroptosis."
Ferroptosis,MIR17,microRNA 17,ENSG00000284536.1,miRNA,30460115,Interactome analysis between these down-regulated gene and up-regulated miRNAs altered by bromelain in CaCO2 cells compared to in DLD-1 cells indicated that ACSL-4 is a key regulatory molecule.
Ferroptosis,GDF15,growth differentiation factor 15,ENSG00000130513.7,protein_coding,32209255,GDF15 knockdown promotes erastin-induced ferroptosis by decreasing SLC7A11 expression.
Ferroptosis,hsa-miR-9,,,miRNA,30035324,"Overexpression of miR-9 suppressed GOT1 by directly binding to its 3'-UTR, which subsequently reduced erastin- and RSL3-induced ferroptosis."
Ferroptosis,hsa_circ_0102187,,,circRNA,35709678,"Our results showed that the circEXOC5 expression was significantly increased in the in vivo and in vitro models of sepsis. And after inhibiting circEXOC5, it improved the lung injury of septic mice. It was confirmed in cell models that ROS levels and ferroptosis in cells were reduced after knocking down circEXOC5. In addition, the expressions of ACSL4 and Gpx4 proteins were regulated by the level of circEXOC5. Finally, we also found that circEXOC5 had a direct binding relationship with PTBP1."
Ferroptosis,ARF6,ADP ribosylation factor 6,ENSG00000165527.8,protein_coding,32368394,Abrogation of ARF6 promotes RSL3-induced ferroptosis and mitigates gemcitabine resistance in pancreatic cancer cells.
Ferroptosis,CDO1,cysteine dioxygenase type 1,ENSG00000129596.5,protein_coding,29144989,CDO1 suppression contributes to ferroptosis resistance.
Ferroptosis,CAMKK2,calcium/calmodulin dependent protein kinase kinase 2,ENSG00000110931.19,protein_coding,34242660,Then we proved that CAMKK2 negatively regulated ferroptosis through the activation of NRF2 and the suppression of lipid peroxidation.
Ferroptosis,NEAT1 ,nuclear paraspeckle assembly transcript 1,ENSG00000245532,lncRNA,35038133,"In vitro, it is found that NEAT1 functions as a ceRNA for miR-9-5p to facilitate TFRC and GOT1 expression. Overexpression of NEAT1 enhanced ferroptosis stress in bEnd.3 cells. Increased miR-9-5p alleviated sepsis-induced ferroptosis by suppressing the expression of TFRC and GOT1 both in vivo and in vitro."
Ferroptosis,LINC01606,long intergenic non-protein coding RNA 1606,ENSG00000253301.6,lncRNA,35485210,"The expression of lncRNA LINC01606 was frequently upregulated in human colon cancer and strongly associated with a poor prognosis. LINC01606 functioned as an oncogene and promotes colon cancer cell growth, invasion and stemness both in vitro and in vivo. Moreover, LINC01606 protected colon cancer cells from ferroptosis by decreasing the concentration of iron, lipid reactive oxygen species, mitochondrial superoxide and increasing mitochondrial membrane potential. Mechanistically, LINC01606 enhanced the expression of stearoyl_¥æ_A desaturase 1 (SCD1), serving as a competing endogenous RNA to modulate miR_?423_?5p expression, subsequently activating the canonical Wnt/å°¾é___tenin signaling, and transcription factor binding to IGHM enhancer 3 (TFE3) increased LINC01606 transcription after recruitment to the promoter regions of LINC01606. Furthermore, we confirmed that upregulated LINC01606 and Wnt/å°¾é___tenin formed a positive feedback regulatory loop, further inhibiting ferroptosis and enhancing stemness."
Ferroptosis,BACH1,BTB domain and CNC homolog 1,ENSG00000156273.16,protein_coding,31740582,These results showed that BACH1 promoted ferroptosis in MEFs.
Ferroptosis,DPP4,dipeptidyl peptidase 4,ENSG00000197635.11,protein_coding,28813679,Required for ferroptosis in TP53-deficient CRC cells.
Ferroptosis,PPP1R13L,protein phosphatase 1 regulatory subunit 13 like,ENSG00000104881.16,protein_coding,32203170,"iASPP overexpression inhibits ferroptosis, and iASPP knockdown promotes ferroptosis in vivo."
Ferroptosis,MIR150,microRNA 150,ENSG00000207782.3,miRNA,30460115,Interactome analysis between these down-regulated gene and up-regulated miRNAs altered by bromelain in CaCO2 cells compared to in DLD-1 cells indicated that ACSL-4 is a key regulatory molecule.
Ferroptosis,FLT3,fms related receptor tyrosine kinase 3,ENSG00000122025.15,protein_coding,24739485,Inhibitor blocked ferroptotic cell death.
Ferroptosis,MAP1LC3A,microtubule associated protein 1 light chain 3 alpha,ENSG00000101460.13,protein_coding,27514700,Potential positive regulators of ferroptosis.
Ferroptosis,A2M-AS1,A2M antisense RNA 1,ENSG00000245105.4,lncRNA,35920801,"The Erastin-induced ferroptosis increased the expression levels of A2M-AS1. The overexpression of A2M-AS1 promoted ferroptosis in the pancreatic cancer, which was inhibited by the silencing of A2M-AS1. Mechanically, A2M-AS1 could directly interact with the poly (rC) binding protein 3 (PCBP3), which plays an important role in the process of iron metabolism, thereby promoting the ferroptosis in pancreatic cancer. In addition, the A2M-AS1/PCBP3 axis could facilitate the p38 activation and inhibit the phosphorylation of the AKT-mTOR signaling pathway; all these participate in regulating ferroptosis."
Ferroptosis,PDSS2,decaprenyl diphosphate synthase subunit 2,ENSG00000164494.12,protein_coding,33929387,PDSS2 Inhibits the Ferroptosis of Vascular Endothelial Cells in Atherosclerosis by Activating Nrf2.
Ferroptosis,DNAJB6,DnaJ heat shock protein family (Hsp40) member B6,ENSG00000105993.15,protein_coding,31701262,DNAJB6 Promotes Ferroptosis in Esophageal Squamous Cell Carcinoma.
Ferroptosis,SUV39H1,SUV39H1 histone lysine methyltransferase,ENSG00000101945.17,protein_coding,33643820,"Mechanistically, we discovered that siRNA knockdown or pharmacological inhibition of SUV39H1 induced iron accumulation and lipid peroxidation, leading to ferroptosis that disrupted ccRCC cell growth in vitro and in vivo."
Ferroptosis,LPCAT3,lysophosphatidylcholine acyltransferase 3,ENSG00000111684.11,protein_coding,32939090,_NA_
Ferroptosis,MIR761,microRNA 761,ENSG00000283899.1,miRNA,32196629,"Additionally, circ-TTBK2 knockdown or miR-761 increase could retard cell proliferation, invasion, and promote ferroptosis in glioma cells."
Ferroptosis,CDCA3,cell division cycle associated 3,ENSG00000111665.12,protein_coding,32939090,_NA_
Ferroptosis,EPAS1,endothelial PAS domain protein 1,ENSG00000116016.14,protein_coding,34561933,D-mannose-induced downregulation of HIF-2Î± inhibits OA progression through suppressing chondrocyte ferroptosis.
Ferroptosis,SLC11A2,solute carrier family 11 member 2,ENSG00000110911.17,protein_coding,34427071,"Conversely, DMT1 knockdown by siRNA evidently blocked temozolomide-induced ferroptosis in TG905 cells."
Ferroptosis,CREB3,cAMP responsive element binding protein 3,ENSG00000107175.12,protein_coding,33846793,CREB stimulates GPX4 transcription to inhibit ferroptosis in lung adenocarcinoma.
Ferroptosis,hsa_circ_0068565,,,circRNA,35847361,"The circACAP2 served as a ceRNA of miR-193a-5p and directly interacted with miR-193a-5p in cervical cancer cells. miR-193a-5p was able to target GPX4 and circACAP2 promoted GPX4 expression by sponging miR-193a-5p in cervical cancer cells. The knockdown of circACAP2 inhibited the cervical cancer cell viability, but the miR-193a-5p inhibitor or GPX4 overexpression could reverse the effect in the cells. The inhibition of miR-193a-5p or GPX4 overexpression repressed the circACAP2 depletion-induced levels of lipid ROS, iron, and Fe2+ in cervical cancer cells."
Ferroptosis,ATF3,activating transcription factor 3,ENSG00000162772.17,protein_coding,34112960,"Taken together, ATF3 contributes to brucine-induced glioma cell ferroptosis via increasing H2O2 and iron."
Ferroptosis,TGFB1,transforming growth factor beta 1,ENSG00000105329.11,protein_coding,32471991,"Therefore, PLC/PRF/5 cells and Huh7 cells were vulnerable to RSL3 in the presence of TGF-Î²1."
Ferroptosis,SMG9,SMG9 nonsense mediated mRNA decay factor,ENSG00000105771.14,protein_coding,34146907,SMG9 drives ferroptosis by directly inhibiting GPX4 degradation.
Ferroptosis,NOX4,NADPH oxidase 4,ENSG00000086991.13,protein_coding,33774476,NOX4 promotes ferroptosis by oxidative stress-induced lipid peroxidation in human astrocytes.
Ferroptosis,MIR27A,microRNA 27a,ENSG00000207808.1,miRNA,36456793,"The relative expression levels of glutathione peroxidase 4(GPx4), solute carrier family 7 member 11 (SLC7A11) proteins were analyzed by Western Blot. The contents of GSH, Fe and malonaldehyde (MDA) were detected by corresponding detection kits, and the target gene of miR-27a was confirmed by dual luciferase reporter gene technique. It was found the relative expression level of miR-27a was increased and ferroptosis was aggravated as reperfusion time went by. Also, brain tissue injury and ferroptosis were exacerbated with agomiR-27a intervention, while these effects were reversed with antagomiR-27a intervention. In addition, the combined intervention of agomiR-27a and Fer-1 alleviated the brain tissue injury and ferroptosis."
Ferroptosis,hsa-miR-92,,,miRNA,31160087,This study revealed a novel mechanism through which miR-17-92 protects endothelial cells from erastin-induced ferroptosis by targeting the A20-ACSL4 axis.
Ferroptosis,hsa_circ_0072464,,,circRNA,35814268,"circ_0072464 and NRF2 were downregulated, and miR-431 was upregulated in IDD. Mechanistically, circ_0072464 competitively bound to miR-431, which targeted and inhibited NRF2 expression. BMSC-derived EVs carrying circ_0072464 inhibited NPC ferroptosis to promote matrix synthesis and proliferation of NPCs by inhibiting miR-431 and upregulating NRF2. Besides, in vivo experiments also confirmed that BMSC-EVs alleviated intervertebral disc lesions in mice with IDD through the circ_0072464/miR-431/NRF2 axis. Collectively, BMSC-EV-loaded circ_0072464 inhibited NPC ferroptosis to relieve IDD via upregulation of miR-431-mediated NRF2, therefore providing a potential therapeutic target against IDD."
Ferroptosis,FOXP1,forkhead box P1,ENSG00000114861.24,protein_coding,34936300,"The expression of E-cadherin was enhanced, and vimentin expression was reduced by the knockdown of circFOXP1. Moreover, the treatment of ferroptosis activator erastin or RSL3 repressed the cell viability of lung cancer cells and the overexpression of circFOXP1 rescued the phenotype. The levels of malondialdehyde (MDA), iron, and lipid reactive oxygen species (ROS) were enhanced by the silencing of circFOXP1 in both erastin and RSL3-stimulated lung cancer cells. Mechanically, circFOXP1 increased SLC7A11 expression by directly sponging miR-520a-5p in lung cancer cells. The inhibitor of miR-520a-5p or the overexpression of SLC7A11 reversed circFOXP1 shRNA-induced ferroptosis phenotypes in lung cancer cells. Importantly, circFOXP1 contributed to tumor growth of lung cancer cells by enhancing SLC7A11 in vivo."
Ferroptosis,SNCA,synuclein alpha,ENSG00000145335.17,protein_coding,32341450,"Alpha synuclein aggregation drives ferroptosis: an interplay of iron, calcium and lipid peroxidation."
Ferroptosis,ENPP2,ectonucleotide pyrophosphatase/phosphodiesterase 2,ENSG00000136960.13,protein_coding,34296293,These data suggested the inhibitory effects of ENPP2 on DOX-induced ferroptosis in H9c2 cells.
Ferroptosis,BRD2,bromodomain containing 2,ENSG00000204256.14,protein_coding,32937365,Inhibition of BET and the proteasome triggers ferroptosis cell death.
Ferroptosis,ISCU,iron-sulfur cluster assembly enzyme,ENSG00000136003.16,protein_coding,30557609,Over expression significantly attenuated DHA induced ferroptosis.
Ferroptosis,PHF21A,PHD finger protein 21A,ENSG00000135365.17,protein_coding,32939090,_NA_
Ferroptosis,PARP6,poly(ADP-ribose) polymerase family member 6,ENSG00000137817.17,protein_coding,33722571,PARP inhibition promotes ferroptosis in ovarian cancer cells.
Ferroptosis,ZEB1,zinc finger E-box binding homeobox 1,ENSG00000148516.23,protein_coding,32896720,"CDH1 silencing or ZEB1 overexpression increased the susceptibility to ferroptosis, whereas CDH overexpression or ZEB1 silencing decreased the susceptibility, in vitro and in vivo."
Ferroptosis,LIG3,DNA ligase 3,ENSG00000005156.12,protein_coding,32939090,_NA_
Ferroptosis,PEDS1,plasmanylethanolamine desaturase 1,ENSG00000240849.11,protein_coding,33731874,TMEM189 promotes ferroptosis resistance via inhibiting expression of FAR1 through plasmalogen synthesis.
Ferroptosis,RPPH1,ribonuclease P RNA component H1,ENSG00000277209.1,RNase_P_RNA,36190453,"Luciferase reporter and RIP assays were implemented to reveal the underlying mechanisms. MiR-375 directly bound to circRPPH1 in gastric cancer cells. And circRPPH1 acted as an miR-375 sponge to positively regulate SLC7A11 expression, which has been confirmed to be the direct target of miR-375 in gastric cancer, and thus regulated ferroptosis. Moreover, circRPPH1 promoted the stemness of gastric cancer cells dependent on the miR-375/SLC7A11. This study provides a potential target for gastric cancer progression based on the circRPPH1/miR-375/SLC7A11 regulatory axis."
Ferroptosis,GFRA1,GDNF family receptor alpha 1,ENSG00000151892.16,protein_coding,34668628,"Combined with the confirmation that the decrease in the GSH/GSSG ratio results in the deactivation of GPX4, which in turn leads to more toxic lipid reactive oxygen species (ROS) accumulation and ferroptosis induction, we can deduce that knockdown of circGFRA1 promotes ferroptosis. In addition, it has been proven that the two pathways mentioned above act in parallel with each other."
Ferroptosis,mmu_circ_0011938,,,circRNA,35952845,"circAFF1 was highly expressed in ICH cell model. Knockdown of circAFF1 attenuated Hb-induced neuronal ferroptosis, as evidenced by inhibiting cell viability, ROS, MDA and iron ion, and promoting GDH levels, which can be counteracted by miR-140-5p knockdown. circAFF1 can target miR-140-5p, and GSK-3å°?was a target gene of miR-140-5p. The effect of miR-140-5p on neuronal ferroptosis can be reversed by GSK-3å°?overexpression. In vivo experiments identified knockdown of circAFF1 suppress ICH injury and inhibits neuronal ferroptosis through regulating miR-140-5p/GSK-3å°?axis."
Ferroptosis,AQP8,aquaporin 8,ENSG00000103375.11,protein_coding,33017631,"Further, we observed that aquaporin (AQP) 3, 5, and 8 bind nicotinamide-adenine dinucleotide phosphate oxidase 2 and regulate the permeability of extracellular H2O2, thereby contributing to ferroptosis."
