deathtype,gene,description,gene_id,gene_biotype,pmid,comment
Ferroptosis,AKT1S1,AKT1 substrate 1,ENSG00000204673.11,protein_coding,33707434,mTORC1 inhibition sensitizes cancer cells or tumors to ferroptosis.
Ferroptosis,MIR19A,microRNA 19a,ENSG00000284204.1,miRNA,35599631,"Studies have shown that miR-19a is identified as oncogenic miRNA and promotes the proliferation, migration and invasion of CRC cells. However, the relationship between miR-19a and ferroptosis in CRC remains unknown. Here, we reported that iron-responsive element-binding protein 2 (IREB2), as an inducer of ferroptosis, was negatively regulated by miR-19a. IREB2 is a direct target of miR-19a. In addition, ferroptosis was suppressed by miR-19a through inhibiting IREB2. Thus, we proposed a novel mechanism of ferroptosis mediated by miR-19a in CRC cells, which could give rise to a new strategy for the therapy of CRC."
Ferroptosis,USP7,ubiquitin specific peptidase 7,ENSG00000187555.17,protein_coding,33157209,USP7 promotes ferroptosis in the I/R-treated hearts via activation of p53/TfR1 pathway.
Ferroptosis,TMSB4Y,thymosin beta 4 Y-linked,ENSG00000154620.6,protein_coding,34280397,Thymosin beta 4 alleviates non-alcoholic fatty liver by inhibiting ferroptosis via up-regulation of GPX4.
Ferroptosis,SIAH2,siah E3 ubiquitin protein ligase 2,ENSG00000181788.4,protein_coding,32042051,"Additionally SIAH2-deficient cells are also characterized by reduced expression levels of glutathione peroxidase 4 (GPX4), rendering the knock-out cells more sensitive to ferroptosis."
Ferroptosis,MIR29A,microRNA 29a,ENSG00000284032.1,miRNA,35720183,"We confirmed high levels of miR-29a-3p in HO-1/BMMSCs exosomes. Overexpression of miR-29a-3p downregulated the expression of Ireb2 and inhibited ferroptosis. Downregulation of miR-29a-3p blocked the protective effect of HO-1/BMMSC exosomes on SHP-HR cell injury. In conclusion, ferroptosis plays an important role in HO-1/BMMSC-mediated alleviation of steatotic liver IRI. HO-1/BMMSCs could suppress ferroptosis by targeting Ireb2 via the exosomal transfer of miR-29a-3p."
Ferroptosis,CHAC1,ChaC glutathione specific gamma-glutamylcyclotransferase 1,ENSG00000128965.13,protein_coding,24844246,Up-regulated in erastin-treated samples.  A useful pharmacodynamic marker of system Xc- inhibition.
Ferroptosis,LINC00616,long intergenic non-protein coding RNA 616,ENSG00000248307.6,lncRNA,35611986,"The lncRNA LINC00616 was upregulated in periodontitis ligament tissues of patients with periodontitis and in PDLSCs treated with LPS-PG. Inhibition of LINC00616 promoted cell viability and suppressed ferroptosis of PDLSCs. miR-370 was verified to be a target of LINC00616, and suppressed miR-370 reversed the effects of LINC00616 knockdown on cell viability and ferroptosis in PDLSCs. Additionally, miR-370 targeting the transferrin receptor protein and upregulated transferrin receptor (TFRC) abolished the effects of overexpressed miR-370 on cell viability and ferroptosis of PDLSCs. LINC00616 acted as a competitive endogenous RNA (ceRNA) to promote ferroptosis of PDLSCs via the miR-370/TFRC axis. Therefore, LINC00616 knockdown may be a promising therapeutic strategy for periodontitis."
Ferroptosis,PRKAA2,protein kinase AMP-activated catalytic subunit alpha 2,ENSG00000162409.12,protein_coding,32029897,AMPK inactivation sensitizes cancer cells to ferroptotic cell death.
Ferroptosis,LONP1,"lon peptidase 1, mitochondrial",ENSG00000196365.12,protein_coding,31822343,Inhibition of LONP1 protects against erastin-induced ferroptosis in Pancreatic ductal adenocarcinoma PANC1 cells.
Ferroptosis,PPARG,peroxisome proliferator activated receptor gamma,ENSG00000132170.24,protein_coding,34478917,PPARG drives ferroptosis in DCs.
Ferroptosis,hsa_circ_0007624,,,circRNA,35840974,"We further demonstrated that circular RNA circBCAR3 was upregulated in the esophageal cancer tissues and cells and regulated the proliferation, migration, invasion, and ferroptosis of esophageal cancer cells in vitro. CircBCAR3 expression was increased by hypoxia and rescued the effects of hypoxia on esophageal cancer cells. Silenced circBCAR3 inhibited the esophageal cancer tumor growth and metastasis in vivo. Mechanistically, E2F7-induced splicing factor QKI increased circBCAR3."
Ferroptosis,MAPK1,mitogen-activated protein kinase 1,ENSG00000100030.15,protein_coding,29330409,ERK1/2 inhibitors inhibited t-BHP-induced ferroptosis. t-BHP treatment significantly increased the protein expression of p-ERK.
Ferroptosis,PEX6,peroxisomal biogenesis factor 6,ENSG00000124587.14,protein_coding,32939090,_NA_
Ferroptosis,PPARA,peroxisome proliferator activated receptor alpha,ENSG00000186951.17,protein_coding,32079652,"In the p53 KO derivatives of both HT-1080 and SK-Hep1 cells, increased PPARÎ± activity suppressed ferroptosis (Fig. 6C, D), while decreased PPARÎ± activity increased their sensitivity to ferroptosis (Fig. 6E,F)."
Ferroptosis,ACSL4,acyl-CoA synthetase long chain family member 4,ENSG00000068366.21,protein_coding,34734006,Downregulation of ACSL4 inhibited sev-induced ferroptosis.
Ferroptosis,ANO6,anoctamin 6,ENSG00000177119.17,protein_coding,31060306,Essential for ferroptosis. Inhibition blocked ferroptotic cell death induced by RSL3/erastin.
Ferroptosis,YTHDC2,YTH N6-methyladenosine RNA binding protein C2,ENSG00000047188.16,protein_coding,33785413,YTHDC2 is an endogenous ferroptosis inducer in LUAD cells.
Ferroptosis,MIR103A1,microRNA 103a-1,ENSG00000199035,miRNA,31606381,PG treatment significantly promoted ferroptosis and anti-tumorigenesis by down-regulating inhibitory effect of miR-103a-3p on GLS2 expression.
Ferroptosis,INTS2,integrator complex subunit 2,ENSG00000108506.13,protein_coding,32939090,_NA_
Ferroptosis,PTPN6,protein tyrosine phosphatase non-receptor type 6,ENSG00000111679.17,protein_coding,34921145,LIFR and SHP1 positively regulate ferroptosis while LCN2 negatively regulates ferroptosis.
Ferroptosis,hsa-miR-7a-5p,,,miRNA,30460115,Interactome analysis between these down-regulated gene and up-regulated miRNAs altered by bromelain in CaCO2 cells compared to in DLD-1 cells indicated that ACSL-4 is a key regulatory molecule.
Ferroptosis,SMAD7,SMAD family member 7,ENSG00000101665.10,protein_coding,32939090,_NA_
Ferroptosis,ATG16L1,autophagy related 16 like 1,ENSG00000085978.22,protein_coding,27514700,Potential positive regulators of ferroptosis.
Ferroptosis,LINC00976,long intergenic non-protein coding RNA 976,ENSG00000229140,lncRNA,36400758,"Knockdown of linc00976 significantly repressed proliferation and metastasis and promoted ferroptosis of CCA cells both in vitro and in vivo, whereas linc00976 overexpression exerted the opposite effect. Mechanistically, linc00976 competitively interacted with miR-3202 to upregulate GPX4 expression, thus contributing to the malignant biological behavior of CCA cells. Moreover, we demonstrated that JUND specifically interacts with the linc00976 promoter and activates linc00976 transcription. Accordingly, JUND promotes linc00976 transcription, and linc00976 plays a crucial role in accelerating CCA tumorigenesis and metastasis and inhibiting ferroptosis by modulating the miR-3202/GPX4 axis."
Ferroptosis,AABR07017145.1,,,lncRNA,34938604,"We found that lncRNA AAB sponged and sequestered miR-30b-5p to induce the imbalance of MMP9/TIMP1, which enhanced the activation of transferrin receptor 1 (TFR-1) and then eventually led to the ferroptosis of CMECs. Moreover, we have developed a delivery system based on neutrophil membrane (NM)-camouflaged mesoporous silica nanocomplex (MSN) for inhibition of cardiac hypertrophy, indicating the potential role of silenced lncRNA AAB (si-AAB) and overexpressed miR-30b-5p as the novel therapy for cardiac hypertrophy."
Ferroptosis,H19,H19 imprinted maternally expressed transcript,ENSG00000130600.21,lncRNA,33273971," It was demonstrated that silencing H19 downregulated Bcl-2 and GPX4 expression and upregulated Bax expression at both the mRNA and protein levels in HTR-8/SVneo trophoblast cells. In conclusion, the present findings suggested that H19 has important roles in SA by promoting apoptosis and ferroptosis."
Ferroptosis,FADS1,fatty acid desaturase 1,ENSG00000149485.19,protein_coding,33288688,Biochemical and lipidomics analyses support the hypothesis that ELOVL5 and FADS1 are required to maintain intracellular levels of AA and AdA and promote ferroptosis.
Ferroptosis,CHP1,calcineurin like EF-hand protein 1,ENSG00000187446.12,protein_coding,32939090,_NA_
Ferroptosis,PRR5,proline rich 5,ENSG00000186654.21,protein_coding,34949833,mTORC2 ablation induces ferroptosis in memory CD4+ T cells.
Ferroptosis,CFL1,cofilin 1,ENSG00000172757.13,protein_coding,34657120,Cofilin1 downregulation attenuates glutamate- and erastin-induced cell death.
Ferroptosis,MIR382,microRNA 382,ENSG00000283170.1,miRNA,34122108,"MiR-382-5p/SLC7A11 axis was involved in lidocaine-mediated inhibition of ovarian and breast cancer cell proliferation in vitro. The miR-382-5p expression was down-regulated but SLC7A11 expression was up-regulated in clinical ovarian and breast cancer samples. Furthermore, the treatment of lidocaine repressed tumor growth of ovarian cancer cells in vivo, in which the miR-382-5p expression was increased while SLC7A11 expression was decreased. Consequently, we concluded that the lidocaine promoted ferroptosis by miR-382-5p/SLC7A11 axis in ovarian and breast cancer cells."
Ferroptosis,LAMP2,lysosomal associated membrane protein 2,ENSG00000005893.17,protein_coding,31672277,Lysosome-associated membrane protein-2 deficiency increases the risk of reactive oxygen species-induced ferroptosis in retinal pigment epithelial cells.
Ferroptosis,PTPN14,protein tyrosine phosphatase non-receptor type 14,ENSG00000152104.12,protein_coding,34883251,"circPtpn14 functions as miR-351-5p sponges to suppress the miRNA. Meanwhile, miR-351-5p could also target 5-LOX for mRNA degradation. CircPtpn14/miR-351-5p/5-LOX signaling may be one of the molecular mechanisms regulating ferroptosis."
Ferroptosis,AGPAT3,1-acylglycerol-3-phosphate O-acyltransferase 3,ENSG00000160216.21,protein_coding,32939090,_NA_
Ferroptosis,STING1,stimulator of interferon response cGAMP interactor 1,ENSG00000184584.14,protein_coding,34195205,STING1 Promotes Ferroptosis Through MFN1/2-Dependent Mitochondrial Fusion.
Ferroptosis,ABCC1,ATP binding cassette subfamily C member 1,ENSG00000103222.20,protein_coding,30726737,Accelerates ferroptosis. Disruption of MRP1 inhibited ferroptosis potently.
Ferroptosis,IFNA5,interferon alpha 5,ENSG00000147873.6,protein_coding,34385713,"Together, our results demonstrate that the autoantibodies and the increased IFN-Î± in SLE sera downregulate the expression of GPX4 and lead to neutrophil ferroptosis."
Ferroptosis,MIR140,microRNA 140,ENSG00000208017.3,miRNA,35271999,"miR-140-5p is abundant in obese ATM-Exos and promotes ferroptosis in cardiomyocytes. Solute carrier family 7 member 11 (SLC7A11) is a downstream target of miR-140-5p, which induces ferroptosis via inhibition of GSH synthesis by targeting SLC7A11. Attenuating exosomal-miR-140-5p expression alleviates ferroptosis and cardiac injury induced by obese ATM exosomes by alleviating GSH inhibition."
Ferroptosis,MYB,"MYB proto-oncogene, transcription factor",ENSG00000118513.20,protein_coding,29144989,Erastin-induced ferroptosis was restrained when c-Myb was suppressed.
Ferroptosis,IFNA6,interferon alpha 6,ENSG00000120235.5,protein_coding,34385713,"Together, our results demonstrate that the autoantibodies and the increased IFN-Î± in SLE sera downregulate the expression of GPX4 and lead to neutrophil ferroptosis."
Ferroptosis,IFNA14,interferon alpha 14,ENSG00000228083.3,protein_coding,34385713,"Together, our results demonstrate that the autoantibodies and the increased IFN-Î± in SLE sera downregulate the expression of GPX4 and lead to neutrophil ferroptosis."
Ferroptosis,circ_0067934,,,circRNA,34290668,The knockdown of circ_0067934 induced thyroid cancer cell apoptosis and repressed thyroid cancer cell proliferation in vitro and in vivo. Circ_0067934 upregulated the expression of the ferroptosis-negative regulator SLC7A11 by sponging and inhibiting miR-545-3p in thyroid cancer cells. The overexpression of SLC7A11 or the inhibitor of miR-545-3p reversed circ_0067934 silencing-regulated thyroid cancer cell proliferation. 
Ferroptosis,BDNF-AS,BDNF antisense RNA,ENSG00000245573.9,lncRNA,35280682,"BDNF-AS overexpression protected GC cells from ferroptosis and promoted the progression of GC and PM. Mechanistically, BDNF-AS could regulate FBXW7 expression by recruiting WDR5, thus affecting FBXW7 transcription, and FBXW7 regulated the protein expression of VDAC3 through ubiquitination. Conclusively, our research demonstrated that the BDNF-AS/WDR5/FBXW7 axis regulates ferroptosis in GC by affecting VDAC3 ubiquitination. BDNF-AS might be a biomarker for the evaluation of GC prognosis and the treatment of GC."
Ferroptosis,TRIB2,tribbles pseudokinase 2,ENSG00000071575.12,protein_coding,34315867,"Here, we demonstrated that deletion of TRIB2 sensitized ferroptosis via lifting labile iron in liver cancer cells."
Ferroptosis,MALAT1,metastasis associated lung adenocarcinoma transcript 1,ENSG00000251562.10,lncRNA,35399101,"We demonstrated that MALAT1 served as a competing endogenous RNA of miR-145-5p to regulate the expression of MUC1, a suppressor of ferroptosis. MALAT1 knockdown-mediated ferroptotic cell death and MUC1 downregulation could be abrogated by inhibition of miR-145-5p. In addition, miR-145-5p inhibition-mediated ferroptotic cell death could be abolished by MUC1 knockdown. Furthermore, erastin-induced ferroptosis shrunk endometriotic lesions via the MALAT1/miR-145-5p/MUC1 axis in vivo. Taken together, our data indicate that knockdown of MALAT1 facilitates ferroptosis upon erastin treatment via miR-145-5p/MUC1 signaling."
Ferroptosis,FH,fumarate hydratase,ENSG00000091483.8,protein_coding,29917289,FH inactivation (FH-/- ) proves synthetic lethal with inducers of ferroptosis. FH-/- sensitizes cells to multiple ferroptosis inducers.
Ferroptosis,lncGm36569,,,lncRNA,35257299,"Further study demonstrated that lncGm36569 was enriched in the MSCs-exo. Through bioinformatics analysis and luciferase assay, we confirmed that lncGm36569 acted as a competitive RNA of miR-5627-5p to induce FSP1 upregulation. Furthermore, overexpression of miR-5627-5p reversed the therapeutic effects of lncGm36569 on neuronal cell ferroptosis. In conclusion, MSCs-exosomes lncGm36569 inhibited neuronal cell ferroptosis through miR-5627-5p/FSP1 axis, thereby attenuating neuronal dysfunction."
Ferroptosis,PEX10,peroxisomal biogenesis factor 10,ENSG00000157911.11,protein_coding,32939090,Genome-wide CRISPR screens identify peroxisome components as contributors to ferroptosis susceptibility.
Ferroptosis,SCD,stearoyl-CoA desaturase,ENSG00000099194.6,protein_coding,34030117,"Mechanistically, SCD1 leads to fatty acid (FA) desaturation and FABP4 derived from TEM enhances lipid droplet (LD) in cancer cells, which cooperatively protect from oxidative stress-induced ferroptosis."
Ferroptosis,hsa_circ_0091740,,,circRNA,35234341,"Further, we found that circ-BGN could directly bind to OTUB1 and SLC7A11, enhancing OTUB1-mediated SLC7A11 deubiquitination and thereby inhibiting ferroptosis, a newly recognized form of cell death that is distinct from apoptosis, necrosis, and autophagy. Moreover, erastin, a small-molecule ferroptosis inducer, could effectively restore the anti-tumor effect of trastuzumab."
Ferroptosis,FTL,ferritin light chain,ENSG00000087086.15,protein_coding,33997705,"Meanwhile, we also showed that apoferritin prevented MPTP-induced ferroptosis effectively by inhibiting the up-regulation of long-chain acyl-CoA synthetase 4 (ACSL4) and the down-regulation of ferroptosis suppressor protein 1 (FSP1)."
Ferroptosis,TSC1,TSC complex subunit 1,ENSG00000165699.15,protein_coding,32404875,Haploinsufficiency of Tsc1 in tubular cells prevents cisplatin-induced tubular cell death and AKI.
Ferroptosis,BRD3,bromodomain containing 3,ENSG00000169925.17,protein_coding,32937365,Inhibition of BET and the proteasome triggers ferroptosis cell death.
Ferroptosis,SLC16A1,solute carrier family 16 member 1,ENSG00000155380.13,protein_coding,33296645,These observations support our hypothesis that HCAR1 and MCT1 are involved in the lactate-dependent ferroptosis resistance in tumor cells. Blocking the HCAR1/MCT1-Mediated Lactate Import Exacerbates Ferroptosis
Ferroptosis,MIR132,microRNA 132,ENSG00000267200.1,miRNA,35249882," RT-qPCR results showed that miR-132 was significantly up-regulated in atherosclerotic plaques compared with normal vascular samples (P < 0.001). Compared with control HUVECs, HUVECs overexpressing miR-132 showed a significantly increased level of intracellular ROS (P < 0.001), and most of ROS was colocalized with mitochondria. HUVECs overexpressing miR-132 also showed significantly decreased MMP (P < 0.001) and obviously increased mtROS (P < 0.001) and opening of mPTP (P < 0.001), which led to mitochondrial REDOX respiratory chain stress disorder. The key iron death protein GPX4 was significantly down-regulated and the oxidized protein NOX4 was significantly increased in miR-132-overexpressing HUVECs."
Ferroptosis,MIR375,microRNA 375,ENSG00000198973.4,miRNA,36336986,"Chromatin immunoprecipitation and dual-luciferase assays showed that binding of IRF7 to the miR-375-3p promoter inhibited miR-375-3p expression, and miR-375-3p suppressed SLC11A2 transcription. The rescue experiments revealed that knockdown of miR-375-3p neutralized the role of silencing IRF7 in alleviating ferroptosis of colonic ECs. Overall, IRF7 upregulated SLC11A2 transcription by inhibiting miR-375-3p expression, thereby prompting ferroptosis of colonic ECs and UC progression in DSS-treated mice."
Ferroptosis,MIOX,myo-inositol oxygenase,ENSG00000100253.13,protein_coding,31437128,"Overexpression exacerbates cell death, knockdown inhibits ferroptosis."
Ferroptosis,Uc.339,,,lncRNA,35399708,"The Uc.339/miR-339/SLC7A11 axis regulated the proliferation, migration and invasion of A549 and H1299cells in vitro by affecting ferroptosis. Finally, in mouse xenograft models, knocking down Uc.339 in LLC cells was able to inhibits tumor growth by blocking the axis of Uc.339/miR-339/SLC7A11 in vivo, but miR-339 inhibitors could reverse this inhibition. Taken together, our results uncovered a Uc.339/miR-339/SLC7A11 axis that leads to defects in the ferroptosis in lung cancer, and constitutes a potential mechanism that drives the metastasis of lung adenocarcinoma."
Ferroptosis,ATXN8OS,ATXN8 opposite strand lncRNA,ENSG00000230223.8,antisense_RNA,35460867,"In conclusion, ATXN8OS mediated ferroptosis and regulated the TMZ-resistance of glioma via ADAR/GLS2 pathway."
Ferroptosis,KLHDC3,kelch domain containing 3,ENSG00000124702.19,protein_coding,34743205,KLHDC3 suppresses ferroptosis in a p14ARF and SLC7A11-dependent manner.
Ferroptosis,MICU1,mitochondrial calcium uptake 1,ENSG00000107745.20,protein_coding,33822458,MICU1 deficiency suppresses cold stress-induced ferroptosis.
Ferroptosis,CBS,cystathionine beta-synthase,ENSG00000160200.18,protein_coding,34737229,CBS Protects BLBC Tumors from Oxidative Stress and Ferroptotic Cell Death.
Ferroptosis,HUWE1,"HECT, UBA and WWE domain containing E3 ubiquitin protein ligase 1",ENSG00000086758.17,protein_coding,35260822,"We investigate the role of HUWE1 in acute liver injury, and identify HUWE1 as a negative ferroptosis modulator through transferrin receptor 1(TfR1). "
Ferroptosis,LINC00472,lncRNA,ENSG00000233237,lncRNA,29588351,"LncRNAs can directly interact with the functional domain of signaling proteins in the cytoplasm, thus regulating p53 modulators to suppress cancer progression."
Ferroptosis,FGF21,fibroblast growth factor 21,ENSG00000105550.10,protein_coding,34530349,FGF21 attenuates ferroptosis by promoting HO-1 ubiquitination and degradation.
Ferroptosis,MIR34A,microRNA 34a,ENSG00000284357.1,miRNA,34558789,"The molecular mechanisms leading to apoptosis and ferroptosis at least included the participation of the miR-34a-5p/Sirt1 axis, in which miR-34a-5p promoted CdCl2 -induced neurotoxicity through targeting Sirt1. Knocking out miR-34a-5p attenuated CdCl2 -induced damage of PC12 cells, cytotoxicity and neurotoxicity."
Ferroptosis,IDH1,isocitrate dehydrogenase (NADP(+)) 1,ENSG00000138413.14,protein_coding,31591388,Deletion of the mutant IDH1 allele or pharmacological inhibition of mutant IDH1 confers resistance to erastin-induced ferroptosis. Ectopic expression of mutant IDH1 promotes ferroptosis.
Ferroptosis,GSK3B,glycogen synthase kinase 3 beta,ENSG00000082701.17,protein_coding,34732689,GSK-3Î² knockdown suppresses erastin-induced ferroptosis.
Ferroptosis,KDM4A,lysine demethylase 4A,ENSG00000066135.13,protein_coding,33689883,KDM4A knockdown promotes ferroptosis in OS cells.
Ferroptosis,PEX12,peroxisomal biogenesis factor 12,ENSG00000108733.11,protein_coding,32939090,Genome-wide CRISPR screens identify peroxisome components as contributors to ferroptosis susceptibility.
Ferroptosis,IDO1,"indoleamine 2,3-dioxygenase 1",ENSG00000131203.13,protein_coding,33899121,Inhibition of IDO prevents reoxygenation-induced ferroptosis.
Ferroptosis,BCAT2,branched chain amino acid transaminase 2,ENSG00000105552.15,protein_coding,33097833,"Here, by using a high-throughput CRISPR/Cas9-based genetic screen in HepG2 hepatocellular carcinoma cells to search for metabolic proteins inhibiting ferroptosis, we identified a branched-chain amino acid aminotransferase 2 (BCAT2) as a novel suppressor of ferroptosis."
Ferroptosis,ADAM23,ADAM metallopeptidase domain 23,ENSG00000114948.13,protein_coding,35003396,Overexpression of ADAM23 suppressed tumorigenesis and promoted ferroptosis in esophageal carcinoma cells.
Ferroptosis,PEX3,peroxisomal biogenesis factor 3,ENSG00000034693.15,protein_coding,32939090,Genome-wide CRISPR screens identify peroxisome components as contributors to ferroptosis susceptibility.
Ferroptosis,ATP5MC3,ATP synthase membrane subunit c locus 3,ENSG00000154518.10,protein_coding,22632970,Required in erastin-induced ferroptosis. Silencing of it conferred against erastin-induced ferroptosis.
Ferroptosis,AQP5,aquaporin 5,ENSG00000161798.7,protein_coding,33017631,"Further, we observed that aquaporin (AQP) 3, 5, and 8 bind nicotinamide-adenine dinucleotide phosphate oxidase 2 and regulate the permeability of extracellular H2O2, thereby contributing to ferroptosis."
Ferroptosis,ADAMTS9-AS1,ADAMTS9 antisense RNA 1,ENSG00000241158.7,lncRNA,35311457,
Ferroptosis,ACSL3,acyl-CoA synthetase long chain family member 3,ENSG00000123983.15,protein_coding,30686757,Required for exogenous monounsaturated fatty acids to protect cells against ferroptosis. Negatively correlates with ferroptosis sensitivity.
Ferroptosis,DDR2,discoidin domain receptor tyrosine kinase 2,ENSG00000162733.19,protein_coding,33603168,DDR2 elevation in recurrent tumor cells contributes to its ferroptosis sensitivity.
Ferroptosis,TERT,telomerase reverse transcriptase,ENSG00000164362.21,protein_coding,34716298,"In contrast, TERT-overexpressing cells exhibited marked elevation in SLC7A11 levels and thereby inhibited ferroptosis."
Ferroptosis,circRNA_101093,,,circRNA,35184419,"Plasma exosome from LUAD patients specifically reduced lipid peroxidation and desensitized LUAD cells to ferroptosis. A potential explanation is that exosomal circRNA_101093 (cir93) maintained an elevation in intracellular cir93 in LUAD to modulate AA, a poly-unsaturated fatty acid critical for ferroptosis-associated increased peroxidation in the plasma membrane. Mechanistically, cir93 interacted with and increased fatty acid-binding protein 3 (FABP3), which transported AA and facilitated its reaction with taurine. Thus, global AA was reduced, whereas N-arachidonoyl taurine (NAT, the product of AA and taurine) was induced. Notably, the role of NAT in suppressing AA incorporation into the plasma membrane was also revealed."
Ferroptosis,IFNA7,interferon alpha 7,ENSG00000214042.1,protein_coding,34385713,"Together, our results demonstrate that the autoantibodies and the increased IFN-Î± in SLE sera downregulate the expression of GPX4 and lead to neutrophil ferroptosis."
Ferroptosis,ECH1,enoyl-CoA hydratase 1,ENSG00000104823.9,protein_coding,33813878,Enoyl coenzyme A hydratase 1 alleviates nonalcoholic steatohepatitis in mice by suppressing hepatic ferroptosis.
Ferroptosis,CS,citrate synthase,ENSG00000062485.19,protein_coding,22632970,Required in erastin-induced ferroptosis. Silencing of it conferred against erastin-induced ferroptosis.
Ferroptosis,AMN,amnion associated transmembrane protein,ENSG00000166126.11,protein_coding,32939090,_NA_
Ferroptosis,DUOX2,dual oxidase 2,ENSG00000140279.13,protein_coding,22632970,Suppresses erastin-induced ferroptosis when inhibited by inhibitor.
Ferroptosis,MBOAT1,membrane bound O-acyltransferase domain containing 1,ENSG00000172197.11,protein_coding,37267948,"In this study, through a whole-genome CRISPR activation screen, followed by mechanistic investigation, we identified phospholipid-modifying enzymes MBOAT1 and MBOAT2 as ferroptosis suppressors"
Ferroptosis,RNF113A,ring finger protein 113A,ENSG00000125352,protein_coding,32152280," RNF113A deficiency indeed potentiated the production of lipid ROS, which accumulate in cells undergoing ferroptosis, upon Cisplatin stimulation, as evidenced by the quantification of BODIPY-C11 staining."
